company_id,oai_identifier,company_name,company_info_1,company_info_2,pdf_page_num,found_year,found_date_modified,register_year,register_date_modified,effect_date_modified,effect_year,item_rank,purpose,city,bs_text,sboard_text,proc_text,capital_text,volume,industry
114c4612d7,1006345701_190700112,"von Poncet Glashüttenwerke A.-G. in Friedrichshain N.-L.,",mit Zweigniederlassung in Berlin.,,863,1905.0,1905-12-16,1906.0,1906-03-21,1905-04-01,1905.0,1.0,Erwerb und Fortführung des von der bisherigen offenen,Friedrichshain,Aktiva Grundst cke Geb ude Masch u Sch chte Mobil,Vors Justizrat Paul Boedner G rlitz Stellv Rittergutsbes Franz von,,M 1 500 000 in 1500 Aktien M 1000 Hypotheken,11,Industrie der Steine und Erden.
115758d11c,1006345701_18970010,Deutsche Treuhand-Gesellschaft in Berlin.,W. Behrenstrasse 9.,,86,,,,,,,,,Berlin,K ontokorrent u Kassa M Effekten M Mobilien M Sa,,,,1,Geld-Institute etc.
115a8a0452,1006345701_190200062,"Brauerei Geismann, Aktiengesellschaft in Fürth (Bayern).",,,1308,1901.0,1901-10-14,1901.0,1901-12-07,1901-10-01,1901.0,1.0,Erwerb u. Fortbetrieb der in Fürth belegenen Bierbrawerei,Fürth,,Vors Heinrich Riagelmann k Komm Rat Anton Sahlmann Rechtsanwalt Jakob,,M 1 180 000 in 1180 Aktien Nr 1 1180,6,Brauereien.
116490d8af,1006345701_190300072,"Brauerei Gross-Crostitz A.-G., Sitz in Leipzig.",,,1251,1901.0,1901-08-01,1901.0,1901-08-03,1901-07-01,1901.0,1.0,,Leipzig,Areal Geb ude Masch Geschirre Fastagen Brauereiinventar Kr ge Flaschen,,,M 1 500 000 in 1500 Aktien M 1000 wovon,7,Brauereien.
11651ccc76,1006345701_190300071,Kohlen-Import-Gesellschaft in Sonderburg.,,,1012,1898.0,1898-10-15,,,,,1.0,,Sonderburg,,,,M 45 000 in 45 Aktien Nr 1 45 M,7,"Bergwerke, Hütten- und Salinenwesen."
1169a5ace3,1006345701_190300072,"Zuckerfabrik Spora, Act.-Ges. in Spora bei Meuselbwitz.",,,438,1872.0,1872-08-03,,,,,1.0,,Meuselbwitz,Grundbesitz Geb ude Brikettfabrik Eisenbahnanlage Schachtanlage Kto Sedan Ziegelei S,,,M 502 000 in 459 Vorz u 43 St Aktien,7,"Bergwerke, Hütten- und Salinenwesen."
116a9d8c15,1006345701_191600202,Westdeutsche Cigarettenfabrik Theodor Oldenkott Akt.-Ges.,in Hagen i. W.,,1559,1912.0,1912-01-23,1912.0,1912-08-03,,,1.0,Herstell. u. Vertrieb von Zigaretten.,Hagen,Warenlager Masch Inventar Warenzeichen Automobil Kassa Postscheck Kto K ln,,,M 300 000 in 300 Aktien M 1000 Urspr M,20,Verschiedene Nahrungs- und Genussmittel-Industrien.
116bad2742,1006345701_190800121,"*Westdeutscher Bank-Verein, Akt.-Ges. in Herdecke",mit Zweigniederlassungen in Wetter und Hagen i. W.,,258,1907.0,1907-01-12,1907.0,1907-01-28,,,1.0,Betrieb von Bank- und Handelsgeschäften jeder Art. Die,Herdecke,,Vors Fabrikbes Heinr Puth Blankenstein Stellv Fabrikbes Th Habig Herdecke,Rob Salomon Paul Schulte Theod B ker ,M 1 000 000 in 1000 Aktien M 1000 ,12,Kredit-Banken und andere Geld-Institute.
11724d7e1c,1006345701_190600101,Carl Hellriegel Akt-Ges. in Berlin.,(Siehe Seite 1173.),,1853,,,,,,,,,Berlin,Masch Lithographien Steine Originale Stempel Utensil Patente Debit Kassa Wechsel,Vors Bankier Ludwig Thalmessinger Stellv Rentier Carl Hellriegel Komm Rat,,,10,Nachträge und Berichtigungen.
117770f546,1006345701_190400081,"Porzellan-Tabriken. Duxer Porzellan-Manufactur, A.-G. vorm. Ed. Eichler.","Sitz der Direktion in Berlin, Zweigniederlassung in Dux.",,1083,1897.0,1897-09-13,,,,,1.0,"Handel mit Porzellan und verwandten Artikeln, sowie Erwerb",Berlin,Grundst ck Fabrik u Wohngeb ude Uasch Utensil Modelle u,Vors Bankier Moritz Herz Berlin Stellv Komm Rat G Sch,,M 1 000 000 in 1000 Aktien Nr 1 1000,8,Industrie der Steine und Erden.
1198c8fec8,1006345701_18970010,"Brauerei zu Gera, Actiengesellschaft in Gera.",,,1217,1873.0,1873-08-03,,,,,1.0,,Gera,Grundst cke M Fastagen M Inventar M Maschinen M K,,,,1,Brauereien.
11a710906e,1006345701_18970010,"Humboldtmühle, Aktiengesellschaft in Berlin.",,,1394,,,,,,,,Betrieb einer Kunstmühle. Kapital: M. 1 000 000,Berlin,Getreide Mehl und Kleie M Fuhrwerk M Comptoir Einrichtung etc,,,,1,Mühlen.
11a7213b8a,1006345701_190000042,"Vereinigte Reliefholz-Werke, Actiengesellschaft",in Düsseldorf.,,907,1899.0,1899-09-05,,,,,1.0,a) Ausnutzung und Verwertung der patentierten Erfindung Xylectypom,Düsseldorf,,Jos Kaiser Peter Kaiser Viersen Paul Bredt jun D sseldorf,,M 400 000 in 400 Aktien Nr 1 400 M,4,"Holz-Industrie, Möbel-Fabriken etc."
11ac25b8a4,1006345701_189900031,Hannoversche Gesellschaft für industrielle Unternehmungen in Hannover.,,,324,1897.0,1897-07-24,1898.0,1898-04-04,,,1.0,Beteiligung in jeder Form an industriellen Unternehmungen und,Hannover,,,,M 5 000 000 in 5000 Inhaber Aktien M 1000,3,"Industrie-Gesellschaften, Handels-Vereine etc."
11b495e9eb,1006345701_190900132,Bielefelder Akt.-Ges. für Grundstücksverwertung,in Bielefeld.,,172,1907.0,1907-05-01,1907.0,1907-05-07,,,1.0,"Erwerb von Grundstücken, insbesondere auch Parzellierung der von",Bielefeld,Aktiva Grundst cke Hypoth Debit Konsortialkto Mobil u Utensil Kassa,Vors Notar Rechtsanwalt Gustav Heidsiek Bielefeld Fabrikant Simon Goldstein Werther,,M 1 000 000 in 1000 Aktien M 1000 Hypotheken,13,Geld-Institute etc.
11bd54b939,1006345701_191100151,*Kleinbahn Kieler Hafenbahn-Akt.-Ges.,in Neumühlen-Dietrichsdorf.,,2168,1909.0,1909-07-10,1910.0,1910-02-18,,,1.0,,Kiel,,Vors Gemeindevorsteher Herm Sch pe Stellv Konsul Georg Howaldt Dir,,M 350 000 in 350 Aktien M 1000 ,15,"Elektrische Strassenbahnen, Klein- und Pferdebahnen etc."
11c64c68c9,1006345701_190400081,Waggon- u. Maschinenfabrik A.-G. vorm. Busch in Hamburg,mit Zweigniederlassung in Bautzen.,,901,1896.0,1896-10-01,,,,,1.0,"Bau u. Verwertung aller Arten Wagen u. Waggons,",Hamburg,verzinsl M mit verzinsl zus M mit halbj K ndig,Vors Dir Max Meyer Berlin Stellv R Mattersdorff W C,D J L Sinram Bautzen Wilh Mentzen Hamburg ,M 3 124 000 in 3124 abgestempelten Aktien Nr 1,8,"Maschinen- und Armaturen-Fabriken, Eisengiessereien etc."
11d0782705,1006345701_190300072,Akt.-Ges. Kronenbräu vorm. M. Wahl in Augsburg.,,,1092,1885.0,1885-07-25,,,,,1.0,Bierbrauerei und Mälzereibetrieb. 1898 wurde die dem Ökonomierat,Augsburg,Grundst ck u Geb ude Masch u Einricht Gespann u,Vors Gust Euringer Stellv Rud Gscheidlen Aug Riedinger Ludw Krauss,,M 2 500 000 in 2500 Aktien Nr 1 2500,7,Brauereien.
11d10080c1,1006345701_189900032,Aktiengesellschaft Fabrik für Brauerei-Einrichtungen,vorm. Heinrich Gehrke & Comp. in Berlin.,,350,1898.0,1898-07-30,,,,,1.0,"Anfertigung von Brauereieinrichtungen, Brauereiutensilien, Bau von Maschinen und",Berlin,,,,M 1 000 000 in 1000 Inhaber Aktien M 1000,3,"Maschinen- und Armaturen-Fabriken, Eisengiessereien etc."
11d45540cb,1006345701_18970010,Fuldaer Aktiendruckerei in Fulda.,,,1112,1873.0,1873-08-03,,,,,1.0,Förderung und Pflege der katholischen Presse und Litteratur.,Fulda,Kassa M Immobilien M Maschinen M Schriften M Mobilien M,Vors Justizrat J Rang Prof A Schick Rob Kircher ,,M 12 000 in 80 Aktien M 150 und M,1,Polygraphische Gewerbe.
11d5e6c92a,1006345701_18970010,"Magdeburger Bank-Verein Klincksieck, Schwanert & C0.",in Magdeburg.,,171,1867.0,1867-06-12,,,,,1.0,Betrieb von Bankgeschäften aller Art.,Klincksieck,,,E Kistner W Schmidt L Leue ,M 7 500 000 in 4 960 Aktien M 600,1,Geld-Institute etc.
11ee59d254,1006345701_189800022,Oberschlesische Bierbrauerei-Actiengesellschaft,"vorm. L. Haendler in Zabrze, mit Zweigniederlassung in Beuthen.",,754,1896.0,1896-05-14,,,,,1.0,Erwerb der Brauerei L. Haendler iu Zabrze nebst,Zabrze,Grundst cke M Geb ude M Maschinen M Lagergef sse,Vors Loebel Haendler in Zabrze Stellv Dir Th Winkler in,,M 1 500 000 in 1500 Aktien zu M 1000,2,Brauereien.
11f43e9aa8,1006345701_191400181,"Werkzeugmaschinen-Akt.-Ges. in Köln, spichernstrasse 8.",,,1417,1901.0,1901-09-04,1901.0,1901-09-11,1901-10-01,1901.0,1.0,Handel mit Werkzeugmasch. u. Werkzeugen aller Art u.,Köln,Grundst cke Geb ude Inventar Modelle Fuhrwerk Material Patente Debit,Vors Bank Dir Herm Wolff C ln Stellv Dr Ernst,,M 750 000 in 142 St Aktien u 608 Vorz,18,"Maschinen- und Armaturen-Fabriken, Eisengiessereien etc."
11f8fb3631,1006345701_189900031,Nürnberger Terrain-Aktiengesellschaft in Nürnberg.,,,1123,1897.0,1897-05-17,,,,,1.0,"Erwerbung, Verwaltung und Verwertung der Grundstücke: a) Pl.-Nr.",Nürnberg,,,,M 2 200 000 in 2200 Inhaber Aktien M 1000,3,Nachträge [aller Branchen]
11f923fbdc,1006345701_190400081,"Allgemeine Häuserbau-Act.-Ges. in Berlin, W. 9 Linkstr. 29 1..",,,403,1872.0,1872-02-29,,,,,1.0,"Grundstücke zu erwerben, und durch Verkauf oder sonstwie",Berlin,Gen Grundst ckskto Strassenregulier Konsortialkto Sch neberg do Charlottenburg Hypoth,,,M 1 285 200 in 2684 Aktien M 300 u,8,"Bau-Banken, Bau-, Terrain- und Immobilien-Gesellschaften etc."
120b2b3298,1006345701_191800222,*Ostdeutsche Hoch- und Tiefbau Akt.-Ges. vorm. Jul. Grosse,,„„ in Thorn. 0,253,1917.0,1917-09-02,1917.0,1917-12-03,,,1.0,"Bauausführungen für eigene oder fremde Rechnung aller Art,",Thorn,der Er ffnungsbilanz der Akt Ges einzurichtenden Konto des,Vors Frau Jul Grosser Anna geb Bezorowski Thorn Dr med,,M 750 000 in 750 Aktien M 1000 bernommen von,22,Geld-Institute etc.
120f939f94,1006345701_191700211,Solinger Bank-Akt.-Ges. in Liquidation in Solingen.,,,363,1877.0,1877-02-02,1877.0,1877-02-09,,,1.0,,Solingen,,,,M 3 600 000 in 1000 Aktien M 300 u,21,Kredit-Banken und andere Geld-Institute.
12190a9b62,1006345701_189900032,"C. Stahmer Fabrik für Eisenbahn-, Bergbau-u. Hüttenbedarf",,,390,1898.0,1898-04-21,,,,,1.0,Erwerb und Betrieb des von der offenen Handelsgesellschaft,,,,,M 1 250 000 in 1250 Inhaber Aktien M 1000,3,"Maschinen- und Armaturen-Fabriken, Eisengiessereien etc."
121b4f02ee,1006345701_191400182,Terraingesellschaft Osnabrück-Nordwest in Osnabrück.,,,276,1898.0,1898-04-26,,,,,1.0,"Erwerb und Verwertung von Grundstücken durch Bebauung, Vermietung",Osnabrück,Aktiva Grundst cke u Geb ude Bankguth Kassa Passiva A,Vors Architekt B B hmer Stellv P Grote Gerh Bergmann,,,18,"Bau-Banken, Bau-, Terrain- und Immobilien-Gesellschaften etc."
121baa2c9d,1006345701_189900031,Actiengesellschaft Mannheimer Liedertafel in Mannheim.,,,1094,,,,,,,,,Mannheim,Immobilien M Wirtschaftskonto M Kapitalkonto M Sparkasse Mannheim M Sa,,,M 114 337 14 in Aktien dieselben werden durch Auslosung,3,"Private und öffentliche Gesellschaftshäuser, Konzert-, Vergnügungs- und Erholungs-Etablissements."
121c78fad2,1006345701_191900232,"J. N. Eberle, Akt.-Ges. in Augsburg.",,,820,1918.0,1918-11-12,1918.0,1918-11-27,1918-07-01,1918.0,1.0,UÜbernahme u. Fortbetrieb des bisher unter der Firma,Augsburg,,Vors Komm Rat Wilh Ammon Heinr Ammon Adolf Ammon Eugen,Georg Gruber Rud S nning Franz Regner ,M 1 000 000 in 1000 Aktien M 1000 bernommen,23,"Uhren-Fabriken, Werkstätten für Feinmechanik etc."
121e90554f,1006345701_191600202,Porzellanfabrik Tettau Akt.-Ges. in Tettau.,,,1065,1915.0,1915-06-12,1915.0,1915-07-01,,,1.0,Fortführ. der Porzellanfabrik Tettau vorm. Sonntag u. Söhne,Tettau,,Vors Bankdir Nik R hrig Coburg Rechtsanwalt Dr Leo Gutmann,,M 150 000 in 150 Aktien M 1000 Urspr M,20,Industrie der Steine und Erden.
1223ed573a,1006345701_190100052,Actien-Bierbrauerei Allstedt in Allstedt.,,,1102,1889.0,1889-08-03,,,,,1.0,"Betrieb einer Bierbrauerei. Absatz 1897/98–1899/1900: 7352, 7071, ?",Allstedt,Immobilien Mobilien Best nde Kassa Effekten Darlehen Debitoren Handlungsunkosten u,,,M 300 000 in 200 St und 100 Vorz Aktien,5,Brauereien.
122acbd227,1006345701_191700212,"Sägewerk Sommersbach-Isny, A.-G. in Isny,","O.-A. Wangen. (Sitz der Ges. bis 1914 in Sommersbach),",,1344,1895.0,1895-03-18,,,,,1.0,,Isny,Immobil u Mobil Debit Bankguth Kassa Lagerbestand Passiva A K,Vors Emil Fritz Stadtschultheiss B r Gottl Erlenbusch Joh Felle,,Urspr M 65 000 erh ht lt G V v,21,Holz-Industrie.
1230ce12a6,1006345701_190800122,"* Porzellanfabrik E. & A. Müller, Akt.-Ges. in Schönwald",bei Selb.,,914,1907.0,1907-11-18,1907.0,1907-12-29,1907-07-01,1907.0,1.0,Herstellung u. Vertrieb von Porzellanwaren aller Art u.,Schönwald,,Vors Komm Rat Dr Rich Michel Bamberg Komm Rat Emil,,M 1 000 000 in 1000 Aktien M 1000 ,12,Industrie der Steine und Erden.
123cd7d896,1006345701_191900232,Aktiengesellschaft für Industriebedarf in Zalenze.,,,802,1918.0,1918-09-08,1918.0,1918-09-11,,,1.0,Fabrik. u. Vertrieb von Gruben- u. sonst. Industriebedarfsgegenständen.,Zalenze,,Vors Justizrat Dr jur Korpulus Breslau Berg Ing Wilh Grewen,Curt Goldammer Carl Heide ,M 300 000 in 300 Aktien M 1000 davon begeben,23,"Maschinen- und Armaturen-Fabriken, Eisengiessereien, etc."
124b3d29bb,1006345701_189900032,Brandenburger Mühlen-Ges. Aug. Ludw. Knönagel & Co.,in Liquidation. Kommanditgesellschaft auf Aktien in Brandenburg a. H.,,765,,,,,,,,,Brand,,,,M 399 000 in Aktien Die Ges ist 1898 in,3,"Getreide-Mühlen, Brot-Fabriken etc."
124df91174,1006345701_18970010,"Aschlag-Säulen-Gesellschaft in Hamburg, Gr. Theaterstr. 46.",,1 37,1130,,,,,,,1.0,,Hamburg,,,,M 45 000 in 60 Stammaktien M 750 mit 40,1,Polygraphische Gewerbe.
1254318577,1006345701_18970010,Actien-Gesellschaft für chemische Industrie in Mannheim.,,,1343,1886.0,1886-08-05,,,,,1.0,"Fabrikation von chemischen Produkten, sowie An- und Verkauf",Mannheim,Fabrik Rheinau Grundbesitz Eisenbahnanschluss Geb ude Maschinen und Apparate Brunnen,Vors Ad Hirt Heidelberg R A A von Harder Kons,E Sexauer H Heuninger ,M 2 000 000 in 2000 Aktien M 1000 ,1,Chemische Industrie und damit verwandte Zweige.
1255297867,1006345701_189900032,Ammerländische Wurst- und Fleischwaren-Fabrik,,"Aktien-Gesellschaft, vorm. J. F. Eylers in Zwischenahn (Grossh. Oldenburg).",865,1898.0,1898-08-30,,,,,1.0,"Fabrikation von Fleisch- und Wurstwaren, Handel mit diesen",Zwischenahn,Logger Konto M Immobilien M Salz M Viktualien M Kohlen,J H Mohr Ph Temme C Jansen G Stavenow ,,M 200 000 in 200 Aktien M 1000 ,3,Verschiedene Nahrungs- und Genussmittel-Industrien.
125b1bce18,1006345701_18970010,Strassburger Bauverein in Strassburg i. E.,,,303,,,,,,,1.0,,Strassburg,,,,M 460 000 in 460 Aktien M 1000 Obligationen M,1,Geld-Institute etc.
125f0c5a77,1006345701_191000141,Debet. Gewinn- u. Verlust-Konto. Kredit.,,,140,,,,,,,,,,,,,,14,Deutsche Notenbanken.
1267021fd6,1006345701_190300072,Act.-Ges. Heerdter Oelwerke in Heerdt b. Neuss. (In Liquid.),,Die Ges. bezweckte Fabrikation von Palmkernöl. Der Betrieb ist eingestellt,818,,,,,,,,,Neuss,Best nde Immobil Mobil Debit Verlust Passiva A K Oblig,Vors Komm Rat Jul Grillo Hamborn Fr Grillo Haus Morp,,M 250 000 in Aktien Urspr M 500 000 herabgesetzt,7,Chemische Industrie und verwandte Geschäftszweige.
12682b5ed2,1006345701_190200061,Alt-Damm-Kolberger Eisenbahn-Gesellschaft in Stettin.,(Siehe Seite 519.),Die G.-V. vom 29./6. 1901 beschloss das A.-K. um M.,1949,,,,,,,,,Stettin,Aktiva Anlagekosten der ganzen Bahnstrecke a Alt Damm Kolberg b,,,,6,Eisenbahnen und Strassenbahnen.
126da9d8b2,1006345701_191100151,Bank für Naphta-Industrie Akt.-Ges. in Berlin,"SW. 11, Königgrätzerstr. 43.",,169,1907.0,1907-03-20,1907.0,1907-03-25,,,1.0,"Erwerb, Veräusserung, Pachtung, Ausbeutung und Betrieb von Naphtafeldern",Berlin,,Vors Ludwig Sachs Garl H sing Ad Soldin Rob Padberg,,M 900 000 in 300 Vorz Aktien u in 600,15,Kredit-Banken und andere Geld-Institute.
1275ff9220,1006345701_189900032,Westfälische Drahtwerke zu Werne,bei Langendreer.,,342,1897.0,1897-08-03,,,,,1.0,"Übernahme und Fortbetrieb der von der Komm.-Ges. Funke,",Werne,,Konsul Emil Freih von Oppenheim Rechtsanwalt Carl Eltzbacher Alfred Freih,,M 1 800 000 in 1800 Inhaber Aktien M 1000,3,Metall-Industrie.
8a1a23d5ca,1006345701_189800021,Frankfurter Transport-Unfall- und Glas-Versicherungs-,,,316,1865.0,1865-03-24,,,,,1.0,"Transport-, Unfall-, Krankheits-, Haftpflicht- u. Glas-Versicherung.",,Aktienwechsel M Hypotheken M Effekten M Haus M Kassa M,,D Lehr C Camphausen A Kenda H Weil O Fricke,M 5 000 000 in 5000 Namenaktien M 1000 mit,2,Versicherungs-Gesellschaften aller Branchen.
8517b38232,1006345701_191300171,"Deutsche Hotel-Akt.-Ges. in Berlin W. 9 (Hotel Esplanade),","Bellevuestrasse 17/18 a, Zweigniederlassung in Hamburg (Hotel Esplanade).",,2035,1907.0,1907-01-14,1907.0,1907-02-20,,,1.0,"Errichtung u. Betrieb eines oder mehrerer Hotels, sowie",Berlin,,Vors Dir Dr jur tto Ecker Eamburg Stellv Rechtsanwalt Wilh,Joel Nathanson Eug Hartenfels Berlin Fritz Bieger Hamburg ,Bis 1911 M 5 000 000 in 5000 St Aktien,17,Hotels und Restaurants.
8ca7a44d2f,1006345701_191400182,Ferd. Rückforth Nachfolger Akt.-Ges. in Stettin.,,,2094,1912.0,1912-12-03,1912.0,1912-12-13,1912-01-01,1912.0,1.0,"Herstell. u. Vertrieb von Hefe, Spiritus, Spirituosen u.",Stettin,,,,M 600 000 in 600 Aktien M 1000 bernommen von,18,"Sprit- und Presshefen-Fabriken, Brennereien."
3e2262646b,1006345701_190600102,Tiefbohr-Akt.-Ges. vorm. Hugo Lubisch in Liquid.,in Düsseldorf. Bureau in Mülheim (Ruhr).,,362,1900.0,1900-05-15,1900.0,1900-06-30,1899-11-01,1899.0,1.0,,Liquid,Inventar Kassa Effekten Schuldner Bohrungen auf eigene Rechnung vorausbez Posten,Mind Vors Bergassessor Arth Jacob Stellv Ober Ing Friedr Reichart,,M 500 000 in 500 Aktien M 1000 Beinahe s,10,"Bergwerke, Hütten- und Salinenwesen."
7ccbd579a2,1006345701_190900131,"Bank für Werte ohne Börsennotiz G. m. b. H. in Berlin W. 64,",Wilhelmstr. 70B.,,177,1906.0,1906-12-11,1906.0,1906-12-29,,,1.0,"An- und Verkauf von Werten ohne offizielle Börsennotiz,",Berlin,Kassa Debit Effekten Coup Mobil Verlust Passiva Eingez Stamm Kap,Vors Ludwig Sachs Carl H sing Ad Soldin ,,M 1 000 000 in 1000 Stamm Anteilen M 1000,13,Kredit-Banken und andere Geld-Institute.
dd05d4b140,1006345701_189800021,"„Concordia“, Spinnerei & Weberei",in Burglehn b. Bunzlau u. in Marklissa.,,796,1888.0,1888-08-03,,,,,1.0,,Burglehn,Grundst ck Geb ude u Wasserkraft M Maschinen u Betriebsutensilien,,,M 3 000 000 in 3000 Aktien M 1000 ,2,Textil-Industrie.
adfac56141,1006345701_190400082,"Eulengebirgsbahn-Akt.-Ges. in Reichenbach, Schlesien.",,,962,1899.0,1899-07-25,,,,,1.0,Bau u. Betrieb der vollspurigen Kleinbahn mit Lokomotivbetrieb,Reichenbach,Eisenbahnbau Grunderwerbskto Kaut Effekten Aktien Debit Kassa Debit Passiva A,Vors Landeshauptmann Herm Freih von Richthofen Landrat Dr jur Ad,,M 5 894 000 in 5894 Aktien M 1000 Urspr,8,"Eisenbahnen, Eisenbahn-Bau- und Betriebs-Gesellschaften."
63eac6d3e2,1006345701_191300172,"Oberrheinische Eisenbahn-Gesellschaft, Akt.-Ges.",in Mannheim.,,368,1911.0,1911-07-08,1911.0,1911-07-29,,,1.0,"Erbauung, Erwerbung, Pachtung u. Betrieb von Bahnen, insbes.",Mannheim,Aktiva Anlagekto der Bahnen Grundst cke u Wohngeb ude Anlage,Vors Stadtrat Ernst Bassermann Stellv Oberb rgermeister Paul Martin Stadtrat,,M 8 000 000 in 8000 Aktien M 1000 bernommen,17,Verkehrs- und Transport-Gesellschaften.
6e53a18068,1006345701_189800021,Friedrichstädter Bankverein in Friedrichstadt.,,,115,,,,,,,,Betrieb von Bank- und Wechselgeschäften.,Friedrichstadt,Wechsel M Debitoren M Inventar M Bank Saldo M Effekten,C F v d Heyde J Lorenzen H S Tychsen,,M 330 000 in Aktien M 300 davon eingezahlt M,2,Geldinstitute etc.
4d301308b8,1006345701_190700112,"Act.-Ges. f. Brückenbau, Tiefbohrung u. Eisenkonstrukt.",in Neuwied a. Rh. mit Zweigniederlassung in Jagstfeld i. Württ.,,688,1899.0,1899-10-21,,,1899-01-01,1899.0,1.0,Erwerb u. Fortbetrieb der von der Firma P.,Neuwied,,Vors Landrat a D Bank Dir Dr W Langen Stellv,Ing Anton Gutacker Kaufm Herm Z ller Neuwied ,M 1 000 000 in 1000 Aktien M 1000 Zur,11,"Maschinen- und Armaturen-Fabriken, Eisengiessereien etc."
dcbb54cb8b,1006345701_190700111,Riquet & Co. Aktiengesellschaft in Gautzsch bei Leipzig,"mit Zweigniederlassung in Leipzig, Goethestrasse.",,1541,1905.0,1905-05-09,1905.0,1905-06-16,1905-01-01,1905.0,1.0,Fortführung des in Leipzig und Gautzsch unter der,Leipzig,Areal Geb ude Masch Treibriemen u Aufz ge Dampf u,Vors Ewald Hugo Gerstmann Leipzig Ph Ferd Ant Seidel Gautzsch,Emil Stein Joh Georg K nig ,M 1 000 000 in 1000 Aktien M 1000 wovon,11,Verschiedene Nahrungs- und Genussmittel-Industrien.
cb6222b312,1006345701_190900132,Vereinigte Schwarzkreidewerke Vehrte in Osnabrück.,,,1060,1891.0,1891-01-01,,,,,1.0,"Ausbeutung von Schwarzkreidebrüchen, auch Gewinnung, Ankauf, Bearbeitung und",Osnabrück,,,,M 180 000 in 180 Aktien M 1000 ,13,Chemische Industrie und verwandte Geschäftszweige.
10f2ddd259,1006345701_189800022,Eschweiler Bergwerks-Verein in Eschweiler-Pumpe.,(Reg.-Bez. Aachen.),,220,1834.0,1834-08-02,,,,,1.0,Betrieb von Steinkohlen- u. anderen Bergwerken. Verwertung d.,Eschweiler-Pumpe,Kohlengruben Konzessionen u Anlagen M Kohlenw schen Kokereien u Kohlendestillation,,,M 000 000 in 40 000 Aktien M 300 wovon,2,"Bergwerke, Hütten- und Salinenwesen."
d3204ff2e1,1006345701_189800022,"Bill-Brauerei Actien-Gesellschaft in Hamburg,",Bullenhuserdamm 173/175.,,663,1889.0,1889-07-31,,,,,1.0,,Hamburg,Grundst ck M Geb ude M Maschinen M Utensilien u,,,M 1 200 000 in 1200 Aktien M 1000 ,2,Brauereien.
57bbb1ee7c,1006345701_190400082,Terrain-Ges. Südende in Südende b. Berlin. (In Liquid.),,"Die Ges. besass am 31./12. 1902 noch 96 096,67 qm",180,,,,,,,,,Berlin,,,,M 1 300 000 in 1300 Aktien Nr 1 1300,8,Geld-Institute etc.
3e8da27530,1006345701_190900132,Stahlwerke Rich. Lindenb erg Akt-Ges. in Remscheid-HHasten,mit Zweigniederlassung in Berlin. fak,,618,1906.0,1906-12-17,1907.0,1907-01-29,1906-08-03,1906.0,1.0,"Betrieb metallurgischer Unternehmungen jeder Art, insbesondere der Betrieb",Remscheid-HHasten,Grundst cke Geb ude Kan le u Schornsteine Dampfkessel H,Vors Dr Walther Rathenau Stellv Geh Komm Rat Karl Kl,,M 2 250 000 in 2250 Aktien M 1000 begeben,13,Metall-Industrie.
389926e912,1006345701_189800022,Naturheilanstalt u. Pension Wittelsbach in Deggendorf.,,,564,1891.0,1891-04-02,,,,,1.0,,Deggendorf,Immobilien M Gewinn und Verlustkonto M Inventar M Vorr te,Vors Rechtsanwalt R Steininger Stellv Heinrich Traber Rentier Georg Fr,,M 35 000 in 35 Aktien M 1000 ,2,Bäder und Heilanstalten.
c7c41f3438,1006345701_191800222,Lübbecker Schutzenhausbaugesellschaft Act.-Ges.,in Lübbecke.,,1530,1873.0,1873-09-06,,,,,1.0,,Lübbecke,Grundst ck Geb ude Wirtsch Utensil ,,,,22,"Private und öffentliche Gesellschafts-Häuser, Gärten, ..."
547a3d8a16,1006345701_190500091,Niederschlesische Portland-Cementfabrik A.-G.,in Neukirch a. Katzbach.,,1055,1902.0,1902-11-29,1903.0,1903-02-12,,,1.0,"Erwerb und Betrieb der der ,Niederschles. Kalk- u.",Nied,,Vors Gustav Pralle Sch neberg Stellv Komm Rat Ad ae,,M 650 000 in 650 Aktien M 1000 Die G,9,Industrie der Steine und Erden.
6a15551af5,1006345701_191300172,"Wagner & Moras, Akt.-Ges. in Zittau.",,,1177,1911.0,1911-05-27,1911.0,1911-07-08,1911-05-01,1911.0,1.0,"Betrieb der Weberei, Färberei, Zwirnerei, Schlichterei u. Appretur,",Zittau,Grundst cke Geb ude WebereiMasch Webst hle Weberei Utensil Webgeschirre,Vors Fabrikbes Friedr Wagner Olbersdorf Stellv Fabrikbes Theodor Seidel Zittau,Hans Meyer Ernst Hornauer Wilh Pohl Karl Zimmer Zittau ,M 3 000 000 in 3000 Aktien M 1000 bernommen,17,Textil-Industrie.
5e550d3e6d,1006345701_190900132,"G. Sauerbrey Maschinenfabrik, Akt.-Ges. in Stassfurt.",,,774,1907.0,1907-02-25,1907.0,1907-03-15,1906-07-01,1906.0,1.0,"Herstellung u. Vertrieb von Maschinen u. ähnlichen Artikeln,",Stassfurt,Grundst cke Fabrikgeb ude Beamtenu Arb Wohnh user Masch Werkzeug,Aufsichtsrat Mind Vors Bankier Karl Hagen Berlin Stellv Bank Dir,Kaufm Walter Strutz Ing Otto Pfannenschmid Ing Karl Toepfer ng,M 1 750 000 in 1750 Aktien M 1000 Urspr,13,"Maschinen- und Armaturen-Fabriken, Eisengiessereien etc."
59ff8175e1,1006345701_190000042,"Wittlager Kreisbahn-Actiengesellschaft in Wittlage,",Prov. Hannover.,,276,1898.0,1898-03-04,,,,,1.0,Bau und Betrieb einer Kleinbahn mit Dampfbetrieb von,Wittlage,,Vors vacat Stellv Landrat Freih v Ledebur Crollage Amtmann Freih,,M 1 220 000 in 20 Nam Aktien M 50,4,Verkehrs- und Transport-Gesellschaften.
69a9e6eadc,1006345701_191000142,Rheinische Seidenweberei Akt.-Ges. in Liqu. in Viersen.,,,1039,1900.0,1900-05-21,1900.0,1900-05-22,,,1.0,,Viersen,Grundst ck Geb ude Aktiv Hypoth fertige Waren Debit Kasse,Kaufm Rud Deus D sseldorf Emil Schiffer Viersen ,,M 500 000 in 500 abgest Aktien M 1000 Urspr,14,Textil-Industrie.
9b35779807,1006345701_190100052,"Minerva“, Act.-Ges. für Patent-Hufbeschlag ohne Nagelung",in Berlin. (In Liquidation.),,1485,1896.0,1896-08-03,,,,,1.0,,Berlin,,,,M 2 000 000 in 2000 Aktien M 1000 Gesch,5,Verschiedene Gesellschaften und Nachträge.
849bd118d4,1006345701_190900132,"Midgard, Deutsche Seeverkehrs-Akt.-Ges. in Nordenham.",Zweigniederlassung in Bremen.,,344,1905.0,1905-11-10,1905.0,1905-12-08,,,1.0,Erwerb u. Betrieb des dem Oldenburg. Staate gehörigen,Nordenham,,,,M 3 500 000 in 3500 Aktien M 1000 Aktien,13,Verkehrs- und Transport-Gesellschaften.
a168b205c4,1006345701_189800021,Fabrik Leipziger Musikwerke vorm. Paul Ehrlich & Co.,in Leipzig-Gohlis.,,616,1880.0,1880-08-03,,,,,1.0,,Leipzig,Immobilien M Maschinen M Werkzeug M Utensilien M Druckerei M,Vors Georg Roediger Stellv Gustav Proessdorf Gustav Krieg L Friedr,,M 500 000 in 500 Aktien M 400 u 250,2,Musikwerke- und Musik-Instrumenten-Fabrik.
b2dbc65087,1006345701_189800022,"Vereinsbrauerei in Rixdorf bei Berlin,",Sitz in Berlin mit Zweigniederlassung in Potsdam.,,615,1872.0,1872-02-01,,,,,1.0,Brauereibetrieb mit eigener Mälzerei. Abgesetzt wurden 1896/97: 171,Berlin,,Miuietsertrag ,Rob Unruh Hans Martens ,M 4 000 000 in 3332 Stammaktien M 300 einer,2,Brauereien.
96afc96236,1006345701_189800022,Baugewerks-Brückenwaage in Karlsruhe in Baden.,,,807,1888.0,1888-10-17,,,,,1.0,,Baden,,K Appenzeller K Augenstein Karlsruhe ,,,2,Nachtrag.
cc9eea972c,1006345701_190300072,"Nollesche Werke, Aktiengesellschaft in Weissenfels.",,,479,1901.0,1901-04-20,1901.0,1901-06-21,1900-07-01,1900.0,1.0,Zweck: Fortführung der unter der Firma Carl Nolle,Weissenfels,Grundst ck Geb ude Masch Werkzeug u Utensil Tischlerei u,Vors Fabrikbes Ferd R the Weissenfels Stellv Fabrikbes Hch Schlieper,,M 875 000 in 875 Aktien Nr 1 875 M,7,Metall-Industrie.
