company_id,oai_identifier,company_name,company_info_1,company_info_2,pdf_page_num,found_year,found_date_modified,register_year,register_date_modified,effect_date_modified,effect_year,item_rank,purpose,city,bs_text,sboard_text,proc_text,capital_text,volume,industry
071b33dc61,1006345701_192000242,Spinnerei und Weberei Kottern in Kottern bei Kempten.,,,1067,1873.0,1873-07-01,,,,,1.0,"Betrieb einer Baumwollspinnerei u. Weberei. 58 000 Spindeln,",Kempten,Grundst cke Wasserkraftanlagen Dampfkraftanlagen Bahnanschluss Fabrikgeb ude Wohngeb ude Masch,Vors Komm Rat Th Kremser Kempten Stellv Nationalrat J H,Herm Kluftinger techn Dir Karl Kinzel Bernh Schwendinger ,M 3 600 000 in 3000 Aktien M 1200 Urspr,24,Textil-Industrie.
2668c273b9,1006345701_192000241,Mechanische Baumwoll-Spinn- und Weberei Kempten,"in Kempten, Bayern.",,2434,1852.0,1852-02-17,,,,,1.0,,Kempten,Immobil Arb H user Masch Spinnstoff Garn T cher u,Vors Komm R Cl Martini Augsburg Stellv Privatier Fritz von,,M 1 800 000 in 2000 Aktien M 900 ,24,Baumwoll-Spinnereien und -Webereien
56a47e737e,1006345701_192000242,Elektrizitäts-Actien-Gesellschaft vorm. W. Lahmeyer & Co.,"in Frankfurt a. M., Taunus-Anlage 6. Im August 1910 wurde",,929,,,1892.0,1892-06-09,,,1.0,"Jede Art gewerblicher Ausnutzung der Elektrotechnik, insbes. Bau,",Frankfurt,,,,M 40 000 000 in 40 000 Aktien M 1000,24,"Elekrtotechnische Fabriken, Elektrizitätswerke und Hilfsgeschäfte."
4195f0002e,1006345701_192000241,Felten & Guilleaume Carlswerk Act.-Ges.,in Cöln-Mülheim.,,1649,1826.0,1826-08-03,1899.0,1899-12-31,,,1.0,Weiterführung des Geschäftes der Handels-Ges. Felten & Guilleaume,Cöln-Mülheim,Grundst cke Geb ude Masch u Apparate Werkzeuge H spel,Mind Vors Geh Komm Rat Freih Theod von Guilleaume C,Herm Baum Dr Ing Gust Berling Ewald Br ck Ad,M 60 000 000 in 60 000 Aktien M 1000,24,"Elektrotechnische Fabriken, Elektrizitätswerke und Hilfsgeschäfte"
c6c77e0d8b,1006345701_189900032,Actiengesellschaft Giessener Braunsteinbergwerke,vorm. Fernie in Giessen.,,252,1898.0,1898-07-02,,,,,1.0,Betrieb der in ihrem Eigentum befindlichen im Deutschen,Giessen,,,,M 3 500 000 in 3500 Inhaber Aktien M 1000,3,"Bergwerke, Hütten- und Salinenwesen."
fe83be5b36,1006345701_192000242,Zuckerfabrik Körbisdorf A.-G. in Körbisdorf bei Merseburg.,,,1752,1872.0,1872-03-07,,,,,1.0,"Fabrikation von Rohzucker, Landwirtschaftsbetrieb, Kohlenbergbau u. Ziegeleibetrieb. Die",Merseburg,,,,,24,Zucker-Fabriken und Zucker-Raffinerien.
0d7f02512f,1006345701_190200061,"Immobilien-Verkehrsbank in Berlin,",W. Markgrafenstrasse 51.,,1984,1890.0,1890-07-03,,,,,1.0,,Berlin,Grundst cke abz Hypoth Kassa u Bankguthaben Effekten Wechsel Mobilien,Aufsichtsrat Bank Dir Rechtsanwalt Carl Buddenberg Bank Dir Herm Tanzen,Friedrich Panse Aug Holz Betriebser ffnung der Filiale am Westdeutsche,M 500 000 in 500 Aktien M 1000 Urspr nur,6,Verschiedene Gesellschaften und Nachträge.
cc79625aad,1006345701_192000242,Trusebahn-Aktiengesellschaft Wernshausen-Herges-Vogtei,in Schmalkalden.,,379,1898.0,1898-11-02,,,,,1.0,"Betrieb der eingeleisigen Kleinbahn (Spurweite 0,75 m) von",Schmalkalden,Aktiva Bahnanlage Ern F a Wertp b Sparkasseguth Kassa Material,,,M 377 000 u zwar M 357 000 in 357,24,Verkehrs- und Transport-Gesellschaften
7cd6a8cb4c,1006345701_190300072,"Vereinigte Eisenacher Brauereien,",Petersberger- und Schlossbrauerei Act.-Ges. in Eisenach.,,1164,1896.0,1896-08-03,,,,,1.0,,Eisenach,Grundbesitz Brauerei u Geb ude Inventar Masch F sser Eisenbahntransportwagen,,,M 1 000 000 in 1000 Aktien M 1000 Anleihe,7,Brauereien.
769631e9d7,1006345701_191000141,Vermögensverwaltungs-Akt.-Ges. über.,,,317,,,,,,,,"Übernahme von Geschäfts-Revisionen und allen mit der Organisation,",,Nicht eingez A K Inventar Debit Bankkto Effekten Kassa Passiva,,,nden Kapital M 400 000 in 400 Aktien M 1000,14,Kredit-Banken und andere Geld-Institute.
384c1fa0f7,1006345701_190300071,Laubenheimer Dampfziegelei in Laubenheim bei Mainz.,,,1415,1892.0,1892-11-04,,,,,1.0,,Mainz,Grundbesitz Geb ude Einrichtung Mobilien Fuhrpark Kassa Waren Debitoren Passiva,,,M 150 000 in 150 Aktien M 1000 ,7,Industrie der Steine und Erden.
ae3ad97907,1006345701_190200062,Griendtsveen Torfstreu-Actiengesellschaft,in Schöninghsdorf bei Meppen.,,444,1901.0,1901-10-17,1901.0,1901-11-22,,,1.0,Erwerb und Ausbeutung von Mooren zur Gewinnung von,Schöninghsdorf,,,,M 100 000 in 100 Aktien Nr 1 100 M,6,"Bergwerke, Hütten- und Salinenwesen."
5740d576b1,1006345701_190700112,"Hohenzollernhütte Roer, Koenig & Co. A.-G. in Emden.",,,398,1906.0,1906-06-27,1906.0,1906-07-09,,,1.0,"Bau und Betrieb von Hochöfen und solchen Betrieben,",Emden,,Schiffsreeder Paul G Roer Bentheim Kaufm Ernst Schellhass Berlin W,,M 3 000 000 in 3000 Aktien M 1000 eingezahlt,11,"Bergwerke, Hütten- und Salinenwesen."
e2c624f490,1006345701_192000241,"Swinemünder Dampfschifffahrts-Akt.-Ges., Swinemünde.",,,1038,1890.0,1890-08-03,,,,,1.0,,Swinemünde,Dampfer Swinem nde do Heringsdorf do Berlin Inventar Lagerschuppen Kaut,,,M 400 000 in 350 Inh Aktien M 1000 u,24,"Dampfschiffahrts-Gesellschaften, Reedereien etc."
4a494f0cbb,1006345701_18970010,Swinemünder Kurbad Aktien-Gesellschaft in Swinemünde.,,,914,1896.0,1896-07-03,,,,,1.0,"Errichtung und Betrieb eines Kurbades, Anlage eines medicomechanischen",Swinemünde,,Vors Herm Dudy Stellv Ad Ploetz Alex Ihlenfeldt B Fritsche,,M 200 000 in 200 Aktion M 1000 ,1,Bäder und Heilanstalten.
5ab35d6914,1006345701_191700211,Russische Eisenindustrie Act.-Ges. in Gleiwitz.,,,945,1900.0,1900-12-07,1901.0,1901-02-01,1900-07-01,1900.0,1.0,"Erwerb u. Pachtung von Bergwerks-Eigentum, Bergwerks-Gerechtsame u. Konzessionen,",Gleiwitz,Grund u Boden inkl Bahn u Gleisanlagen Geb ude Masch,Vors Geh Komm Rat Osc Caro Hirschberg Stellv Bankier James,Eugen Johae Dr jur Rud Freund Gleiwitz Max Sperling Gust,M 15 000 000 in 15 000 Aktien M 1000,21,Erzbergwerke und Hüttenbetriebe.
00ce66e5a8,1006345701_190300071,"Aktiengesellschaft für Liniir-Apparate, Patent Grosse",in Leipzig. Thomasring 5.,,1078,1899.0,1899-04-28,1899.0,1899-12-30,,,1.0,"Erwerb, Ausbeutung und sonstige Verwertung der von Bernhard",Leipzig,Patente Betriebsmaschinen Inventar Utensil Waren Debit Kassa Verlust Passiva A,,,M 150 000 in 150 Aktien Nr 1 150 M,7,Metall-Industrie.
a2852cf39c,1006345701_191900232,"„Rhemag“' Rhenania Motorenfabrik Akt.-Ges., Mannheim.",,,763,1917.0,1917-05-04,1917.0,1917-05-11,,,1.0,"Herstellung und der Vertrieb von Motoren jeglicher Art,",Mannheim,Aktiva Geb ude Masch Transmissionen u Riemen Werkzeuge Werkstatteinricht B,Geh Komm Rat Dr Ing h c Carl Haegele Geislingen,,M 1 000 000 in 1000 Aktien M 1000 bernommen,23,"Maschinen- und Armaturen-Fabriken, Eisengiessereien, etc."
073e8e4210,1006345701_190900132,Frankenthaler Kesselschmiede und Maschinenfabrik,,"Kühnle, Kopp & Kausch, Aktiengesellschaft in Frankenthal, Pfalz.",704,1899.0,1899-04-04,,,,,1.0,"Dampfmaschinen- und allg. Maschinenbau, Dampfkessel- und Apparatebau, Eisengiesserei",Frankenthal,Grundst ck Geb ude Masch Ger te Werkzeuge u Mobil,Vors Komm Rat Hans Kopp Frankenthal Stellv Gen Dir Komm,Ing Aug Neumann Kaufm Rud Krepp ,M 1 500000 in Aktien M 1000 Anleihe 31 7,13,"Maschinen- und Armaturen-Fabriken, Eisengiessereien etc."
8f64e3d5f7,1006345701_191900232,"Geraer Actienbierbrauerei zu Tinz bei Gera, Reuss.",,,1811,1872.0,1872-05-28,,,,,1.0,,Gera,Grundst cke u Geb ude I Masch K hlanlage Brauerei,Vors Stadtrat G Hartig Stellv Alfr Kratzsch Eug Geppert Georg,,M 412 500 in 1375 abgest Aktien M 300 fr,23,Brauereien.
4a2368d025,1006345701_192000242,Bergschlösschen-Brauerei Wencker & Co.,Actiengesellschaft in Dortmund.,,1368,1898.0,1898-04-25,,,1897-10-01,1897.0,1.0,,Dortmund,Grundst cke Geb ude ausw rtige Besitz Wertp Forder Verlust,,Ludw Burgardt Math Richartz Dortmund ,M 500 000 in 500 Aktien M 1000 Anfang Okt,24,Brauereien.
fcb67b46f3,1006345701_190800122,Rheinische Seidenweberei Aktiengesellschaft in Viersen.,,,983,1900.0,1900-05-21,1900.0,1900-05-22,,,1.0,Herstellung u. Verkauf von ganz- u. halbseidenen Stoffen,Viersen,Grundst ck Geb ude Masch Rohe u gef rbte Seide,,,M 500 000 in 500 abgest Aktien M 1000 Urspr,12,Textil-Industrie.
9a39fa1d2a,1006345701_192000241,Actiengesellschaft „Erholung“ in Viersen.,,,2351,1877.0,1877-08-03,,,,,1.0,,Viersen,Immobil I Mobil Immobil II Verlust Passiva A K Hypoth,,,M 47 400 in Nam Aktien M 150 u 55,24,"Zoologische Gärten, Aquarien etc."
e974e6410f,1006345701_190700112,Hohenzollern'sche Kleinbahngesellschaft in Sigmaringen.,,,296,1899.0,1899-07-05,,,,,1.0,Bau u. Betrieb der vollspurigen Kleinbahnen in den,Sigmaringen,Bahnanlage Kaut Effekten Effekten des Ern F u R F,Vors Hofkammerrat H lsemann Stellv Reg Pr s Franz Graf,,M 3 488 000 u zwar M 872 000 in,11,Verkehrs- und Transport-Gesellschaften.
7a52471263,1006345701_190200061,Zoologischer Garten für Aachen und Burtscheid in Aachen.,,Letzte Statutenänd. vom 13./7. 1899 u. 5./5. 1900.,1927,,,,,,,,"Betrieb und Unterhaltung eines zoologischen Gartens, welcher verpachtet",Aachen,,,,M 190 000 in 190 Aktien M 1000 Den Aktion,6,"Zoologische Gärten, Aquarien etc."
25c5a4eb02,1006345701_192000242,Oberschlesische Zinkhütten-Akt.-Ges. in Kattowitz 0.8.,,,496,1906.0,1906-02-22,1906.0,1906-03-06,1905-07-01,1905.0,1.0,Erwerb und Betrieb der oben bezeichneten Werke und,Kattowitz,Grund u Boden H ttenanlagen Arb Wohnh user Masch u,Mind Vors Geh Reg Rat Rich Witting Berlin Stellv Ed,,M 3 750 000 in 3750 Aktien M 1000 Hypotheken,24,"Bergwerke, Hütten- und Salinenwesen"
d5bb93cb73,1006345701_192000241,Deutsche Bank in Berlin W.,"Direktion Berlin W. 8, Mauerstr. 35–42.",,168,,,,,,,,"Betrieb von Bankgeschäften aller Art, insbes. Förderung u.",Berlin,Bargeld Sorten Zinsscheine u Guth bei Abrechn Banken Guth bei,Vors Gen Konsul Rud von Koch Berlin Stellv Geh Komm,,M 275 000 000 eingeteilt in 100 000 Aktien Nr,24,Kredit-Banken und andere Geld-Institute.
4171c207f5,1006345701_191200161,Niederdeutsche Bank,"Kommanditgesellschaft auf Aktien in Konkurs in Dortmund, Filialen in Bedburg,","merhaven (Bremische Bankanstalt), Bremervoerde (Bremervoerder Bank), Gewähr. übermässigen Kredits, Verluste",228,1898.0,1898-11-20,1899.0,1899-02-09,,,1.0,Betrieb von Bank- u. Handelsgeschäften. 1907 Übernahme der,Nied,Kassa u Reichsbank Coup Sorten Bankguth reportierte Effekten eigene do,Vors Justizrat Ed Huchzermeier Gelsenkirchen Stellv Stadtrat Gustav Maiweg Dortmund,,M 12 000 000 in 12 000 Aktien M 1000,16,Kredit-Banken und andere Geld-Institute.
67a2e19d71,1006345701_192000241,Deutsche Nationalbank Komm.-Ges. auf Aktien in Bremen.,(Firma bis 4./4. 1906 Nordwestdeutsche Bank Komm.-Ges. auf Aktien.) Zweigniederlassungen,,195,1898.0,1898-08-16,1898.0,1898-08-19,1911-01-01,1911.0,1.0,Betrieb aller Art Bank- u. Handelsgeschäfte.,Bremen,Kassa Guth bei Noten u Abrechn Banken Wechsel u unverzinsl,Mind Vors Senator Heinr B mers Stellv Rechtsanw u Notar,,M 33 000 000 in 33 000 Aktien M 1000,24,Kredit-Banken und andere Geld-Institute.
1ed8501d80,1006345701_192000241,„Herne“ Vereinigung von Hibernia-Aktionären G. m. b. H.,in Güstrow i. M. (bis April 1910 in Berlin W.,,237,1904.0,1904-12-12,1904.0,1904-12-23,,,1.0,Erwerb und gemeinsame Verwaltung von Aktien der Bergwerksges.,H,Ausstehende Einzahlung auf Stammeinlagen der Gesellschafter Oblig Unterlagseffekten Bankguth Passiva,,,M 42 000 000 gezeichnet von den obengenannten 6 Gesellschaftern,24,Kredit-Banken und andere Geld-Institute.
407946343f,1006345701_190000042,Kaiser-Brauerei in Ricklingen bei Hannover.,,,363,1888.0,1888-08-03,,,,,1.0,Bierbrauerei und event. Eröffnung von Wirtschaftslokalitäten. Bierabsatz 1889/90,Hannover,Grundst cke I do II Geb ude Maschinen u Ger,Vors S Katz Stellv Baron v K nigswarter Boltze Zomber,,M 600 000 in 600 Aktien M 1000 ,4,Brauereien.
f6349d72cb,1006345701_190200061,Brauerei Iserlohn Aktiengesellschaft in Grüne,bei Iserlohn.,,1838,1899.0,1899-08-28,1899.0,1899-10-03,,,1.0,,Grüne,Bankguthaben Unkosten Inventar Immobilien Maschinen Kessel K hl u Elektr,Martin Finzel K ln Bankier Herm Wulff Dortmund Rentner Joh,,M 500 000 in 500 Aktien Nr 1 500 M,6,Brauereien.
ac3958bd10,1006345701_192000242,Georg Grauert Akt.-Ges. in Berlin-Stralau.,(Alt-Stralau 67.),,689,1910.0,1910-03-29,1910.0,1910-05-04,1909-07-01,1909.0,1.0,Fortbetrieb der von der offenen Handels-Ges. Georg Grauert,Berlin-Stralau,Baulichkeiten Inventar Giesserei Utensil Werkzeuge Formenk sten Modelle Material roh,Vors Emil Cohn Stellv Justizrat Jul Guttmann Berlin Architekt Paul,,Urspr M 380 000 in 380 Aktien M 1000 Das,24,"Maschinen- und Armaturen-Fabriken, Eisengiessereien etc."
97b5fbe0f7,1006345701_192000241,Elsässische Gesellschaft für Jute-Spinnerei und Weberei,in RBischweiler i. Els.,,2487,1883.0,1883-05-08,,,,,1.0,"Herstell. von Garnen u. Geweben aus Jute, Hanf,",RBischweiler,Grundst Fabrikgeb ude elektr Kraftanlagen Masch u Betriebseinricht Landwirtsch Wohlfahrtseinricht,Vors C H Schaar Hamburg Bankdir Jos Schwartz Georg Herrenschmidt,,M 1 600 000 in 800 St Aktien M 800,24,Jute-Spinnereien und -Webereien
23bd1b32b6,1006345701_190800121,Oberhohndorfer Schader-Steinkohlenbau-Verein in Liqu.,in Oberhohndorf bei Zwickau i. S.,,909,1855.0,1855-08-03,,,,,1.0,,Liqu,,Vors Heinr W rker Stellv Ernst K stner Komm Rat,,,12,"Bergwerke, Hütten- und Salinenwesen."
4b40c221e2,1006345701_192000241,A.-G. Herseler Erziehungs-Anstalt zu Hersel b. Bonn a. Rh.,(Pensionat der Ursulinen.),,2327,,,,,,,,,Bonn,Kassa Immobil Schuldentilg F Passiva A K Hypoth Darlehen Baukosten,Klosterdamen Magdalena Horn Schwester Alfonse Stellv Martha Reiffer Schwester Ambrosia,,M 100 000 in 100 Aktien M 1000 Hypotheken M,24,"Gemeinnützige und Wohltätigkeits-Anstalten, Religiöse Vereinigungen, Schulen etc."
b96f201d57,1006345701_18970010,"Consum-Verein Zawadzki, Actien-Gesellschaft in Zawadzki.",,,1461,,,,,,,,,Zawadzki,Kassa M Warenbestand M Debitoren M Utensilien M Sa M,,,18 000 Gesch ftsjahr Kalenderjahr Gen Vers Bis Juni ,1,Konsum-Vereine.
7edc9eea99,1006345701_191900231,"Carl Flemming, Verlag, Buch- und Kunstdruckerei,","Akt.-Ges. in Glogau, Zweigniederlassung in Berlin W. 50, Geisbergstr. 2.",,2103,1898.0,1898-02-04,,,,,1.0,"Erwerb und Fortführung sämtl., der Firma Carl Flemming,",Glogau,Grundst cke Geb ude elektr Beleucht Anlage elektr Kraftanlage Masch,Vors Bank Dir M Pioletti G rlitz Stellv Fabrik Dir,Betriebs Dir Aug Bell Oskar Klamka Adolf Franke ,M 1 000 000 in 1000 Aktien M 1000 Urspr,23,"Druckereien, Buch- und Zeitungs-Verlag, Kunst-Anstalten, Buchhandel, Telegraphen- und Annoncen-Bureaus."
5337eb0f36,1006345701_192000242,"Braunkohlenwerke Leonhard Akt.-Ges. in Zipsendorf,",Kreis Zeitz.,,592,1907.0,1907-02-11,1907.0,1907-06-14,1906-07-01,1906.0,1.0,"Erwerb und Betrieb von Braunkohlenbergwerken und Brikettfabriken, insonder-",Zipsendorf,Grundst cke Kohlenabbau Rechte Bagger Anlagen Gruben do Brikettfabrik do,Mind Vors Komm Rat Ant Gust Wittekind Stellv Bank Dir,H Langenberg Ed Dietzel H Herlitz Otto Schlimper ,M 8 000 000 in 8000 Aktien M 1000 Urspr,24,"Bergwerke, Hütten- und Salinenwesen"
d641aeeb41,1006345701_192000241,"Dampfziegelwerk Sachsenhagen, A.-G. in Sachsenhagen",(Hannover).,,1817,1904.0,1904-03-29,1904.0,1904-03-30,,,1.0,,Sachsenhagen,Aktiva Grundst cke Geb ude Masch Utensil Kassa Inventurbest nde,Vors Wilh Stelling D Philippsohn H Stelling H Scheer Ed,,1 M 72 000 in 60 Nam Aktien M 1200,24,"Tonwaren- und Chamotte-Fabriken, Ziegeleien"
5fcec7aec7,1006345701_191900232,Mech. Zwirnerei Heilbronn vorm. 0. Ackermann & Cie.,in Sontheim bei Heilbronn.,,1062,1882.0,1882-08-03,,,,,1.0,"Betrieb einer Baumwollzwirnerei u. Fabrikation von Näh-, Häkel-",Heilbronn,Aktiva Gr ndst cke u Ged ude Masch u Einricht,Vors Komm Rat A Heermann Osc Tscherning Rich R melin,C Schultheiss Dr jur Carl Ackermann ,M 2 250 000 in 2250 Nam Aktien M 1000,23,Textil-Industrie
c62ef47cb7,1006345701_190000042,"Aktienbrauerei Simmerberg in Simmerberg,",Station Röthenbach bei Lindau.,,378,1897.0,1897-07-30,1898.0,1898-08-03,,,1.0,Erwerb und Fortbetrieb der bisher unter der Firma,Simmerberg,Immobilien Wirtschaftsanwesen Maschinen Inventar Fastagen Gespanne Vorr te an Bier,,,M 650 000 in 650 Aktien Nr 1 650 M,4,Brauereien.
819b359bb1,1006345701_191800222,Greussener Malzfabrik Asdes Ggsellakan in Greussen i. Th.,,,1873,1890.0,1890-08-03,,,,,1.0,,Greussen,Grundst cke Geb ude Masch ,Vors konomierat Victor Hornung Wasserthalleben Rentier E Wiegleb ,,M 400 000 in 80 Aktien M 5000 Hypotheken M,22,Mälzereien.
57fc478a2b,1006345701_191400182,Actien-Brauerei Greussen in Greussen i. Thür.,,,1828,1883.0,1883-08-03,,,,,1.0,,Greussen,Grundst ck Geb ude u Kellerei Grundst ck Gem Schenke,Vors Rentier Carl Fickewirth Kaufm Lindau Aug M hlrath C,,M 300 000 in 500 abgest Aktien M 300 u,18,Brauereien.
e1fb1970c9,1006345701_191800222,Württemb. Act.-Ges. f. Fabrikation v. Leim- u. Düngmitteln,in Reutlingen. (In Liquidation.),,1192,1858.0,1858-08-03,,,,,1.0,,Act,Kassa Geb ude Liegenschaften ,Vors Albert Pfizenmayer Werkmeister P Geiger Hofrat Rud Finkh ,mit Wirkung vom gleichzeitig emittiert Prior Aktien M durch,M 115 500 und zwar M 55 500 in 185,22,Chemische Industrie und verwandte Geschäftszweige.
c1948f8204,1006345701_190200062,Wilhelmshavener Aktien-Brauerei in Wilhelmshaven.,,,1502,1896.0,1896-11-02,,,,,1.0,"Betrieb des Bierbrauereigewerbes. Absatz 1898–1900: 22 600, 26",Wilhelmshaven,Grund u Geb ude Maschinen u Apparate M blement Pferde,Vors Dr Karl Aug Balke Ed Ulrich Buss Fr Kloppmann,,M 800 000 in 750 Inh Aktien M 1000 und,6,Brauereien.
44576dd2b0,1006345701_190000042,"Zuckerfabrik Brühl in Brühl, Rheinl.",,,1016,1883.0,1883-08-03,,,,,1.0,"Fabrikation von Rohzucker, sowie Betrieb eines Braunkohlenbergwerks und",Brühl,Immobilien Bahnanschluss Geb ude Maschinen Utensilien Mobilien Beleuchtungsanlage Schnitzeltrocknungsgeb ude,,,M 1 050 000 in Aktien ,4,Verschiedene Nahrungs- und Genussmittel-Industrien.
52c943aaaf,1006345701_190300071,Pfälzische Textil-Industrie Otterberg Akt.-Ges.,"in Otterberg bei Lampertsmühle, Rheinpfalz.",,1554,1900.0,1900-02-17,1900.0,1900-03-10,,,1.0,"Errichtung, Erwerbung und Betrieb von Fabriken zur Herstellung",Otterberg,Aktiva Immob u Einrichtung Debitoren Kassd Versich Utensilien Materialien u,,,M 500 000 in 500 Aktien Nr 1 500 M,7,Textil-Industrie.
434a2956cb,1006345701_191900231,Aktien-Gesellschaft der Warmbadeanstalt in Rendsburg.,,Die Akt.-Ges. ist aufgelöst; die Anstalt ist auf die Stadt,2369,,,,,,,,,Rendsburg,,,,M 1050 in abgest Aktien Urspr M 6000 herabgesetzt lt,23,"Bäder, Quellen-Produkte, Wasch-Anstalten etc."
cfde9d172a,1006345701_191100151,"Stahl- und Walzwerk Rendsburg, A.-G. in Rendsburg.",,,1091,1904.0,1904-02-27,1904.0,1904-05-04,,,1.0,Betrieb der in den letzten Jahren neu erbauten,Rendsburg,Grundst cke Wege u Kanalisation Z une Wohngeb ude Kolonie,Vors Komm Rat Hch Vogel Dresden Bankier Oscar Lackner WiesbadenKonsul,Ing R Hackert ,M 2 000 000 und zwar in 1000 Vorz Aktien,15,Metall-Industrie.
80648f83e7,1006345701_191300171,"Fr. Hesser A.-G., Maschinenfabrik in Stuttgart-Cannstatt.",,,1440,1911.0,1911-06-07,1911.0,1911-07-08,,,1.0,Erwerb u. Fortbetrieb des unter der Firma Fr.,Stuttgart-Cannstatt,Grundst cke u Geb ude neues Fabrikgeb ude im Bau,,Theodor Gros G Schilbach ,M 500 000 in 500 Aktien M 1000 ,17,"Maschinen- und Armaturen-Fabriken, Eisengiessereien etc."
b0f0555991,1006345701_190400081,Baumwollweberei Mittweida in Mittweida.,,,1467,1893.0,1893-07-04,,,,,1.0,Betrieb von Baumwollwebereien u. aller in das Textilfach,Mittweida,Aktiva Grundst ck u Geb ude Maschinen u Utensil Warenbest,,,M 600 000 in 600 Aktien Nr 1 600 M,8,Textil-Industrie.
df6d7de01d,1006345701_192000242,Draht- und Kratzenstoffwerke Akt.-Ges. in Mittweida.,,,641,1916.0,1916-06-26,1916.0,1916-07-05,,,1.0,Erwerb u. Weiterbetrieb der auf Blatt 536 des,Mittweida,Grundst ck Geb ude Masch Pferde u Geschirr Waren u,Vors Fabrikdir Lebrecht Steinegger Mittweida Stellv Fabrikdirekt ,,M 550 000 in 550 Aktien M 1000 Urspr M,24,Metall-Industrie.
2aa3be15a3,1006345701_190900132,Stein- und Marmor-Sägerei Schachenmühle,in Strassburg-Neudorf i. Els. mit Zweigniederlassung in Oos.,,907,1890.0,1890-07-01,,,,,1.0,,Strassburg-Neudorf,Masch u Einricht Immobil Effekten Debit Beteil Passiva A K,,,Urspr M 250 000 in 250 Aktien M 1000 Die,13,Industrie der Steine und Erden.
cbbbfe7132,1006345701_191900231,Duncan's Leinen-Industrie-Akt.-Ges. in Grossschweidnitz,(Sachsen).,,2195,1856.0,1856-08-03,1905.0,1905-11-02,,,1.0,"Betrieb aller Zweige der Leinenindustrie. Spezialität: Bleicherei, Färberei,",Grossschweidnitz,Grundst cke Geb ude Masch neue Wasseranlage elektr Kraftanlage elektr,Vors Oberleutn Viktor Grosse Dresden Stellv Rechtsanw u Notar Dr,,M 2 000 000 in 2000 Aktien M 1000 ,23,"Holz-Industrie, Möbel-Fabriken etc."
aac788c7f2,1006345701_190300071,"Oberschlesische Aktien-Gesellschaft für Fabrikation von Lignose, Schiesswollfabrik für Armee und Marine","in Kruppamühle mit Zweigniederlassung in Kriewald, O.-Schl.",,1657,1873.0,1873-09-03,,,,,1.0,"Herstellung und Verwertung von Schiess- und Sprengmaterial, sowie",Kruppamühle,Anlage Kruppam hle Grundst cke Geb ude Maschinen Dynamitfabrikanlage Glycerinfabrikanlage,Vors Dr Wachler ,,M 650 000 in 650 Aktien Nr 1 650 M,7,Chemische Industrie und verwandte Geschäftszweige.
a02769fb0b,1006345701_190200062,Kleinbahn-Aktiengesellschaft Ziesar-Gross-Wusterwitz,mit Sitz in Ziesar.,,244,1901.0,1901-05-21,1901.0,1901-07-27,,,1.0,"Bau und Betrieb der eingleisigen, vollspurigen Kleinbahn von",Ziesar,,Vors Landrat a D Graf Ludwig von Wartensleben Rog sen,,M 852 000 in 852 Aktien Nr 1 852 M,6,Verkehrs- und Transport-Gesellschaften.
4afd1c013b,1006345701_191700212,Eichener Walzwerk & Verzinkerei Akt.-Ges. in Kreuztal.,(.reis Siegen.),,568,1907.0,1907-04-13,1907.0,1907-06-08,1906-07-01,1906.0,1.0,"Betrieb von Werken, welche der Erzeugung u. Weiterverarbeitung",Kreuztal,Grundst cke Geb ude Masch Werkzeuge u Ger te Schlafhauseinricht,H chstens Vors Emil Steffen Weidenau Joh Sch tz Eichen,Prokuristen Wilh Heinemann Herm St hler Emil Opderbecke ,M 2 500 000 in 2500 Aktien M 1000 Urspr,21,Erzbergwerke und Hüttenbetriebe.
514c420e43,1006345701_192000242,Kartoffelflocken-Fabrik Pretzsch (Elbe) A.-G. in Pretzsch.,,,1815,1909.0,1909-08-29,1910.0,1910-03-01,,,1.0,Errichtung u. Betrieb einer Kartoffeltrocknungsanlage zur Herstellung von,Pretzsch,Grundst ck und Geb ude Masch Anschlussgleis Mobil Sack Effekten,Vors Rob Sensenhauser Emil Lindau Ernst Richter Otto Leipziger Ernst,,M 60 000 in Nam Aktien M 200 begeben zu,24,Verschiedene Nahrungs- und Genussmittel-Industrien.
fe916d7af5,1006345701_192000242,Eisern-Siegener Eisenbahn-Gesellschaft in Siegen.,,,285,1881.0,1881-03-07,,,,,1.0,Bau u. Betrieb einer Sekundäreisenbahn von Eisern nach,Siegen,Aktiva Bau u Ausr st der Bahn Material u Wertp,Vors Dir W Petersen Niederschelden Stellv Komm Rat Friedr Springorum,,M 600 000 in 800 St Aktien Serie I M,24,Verkehrs- und Transport-Gesellschaften
ee7af9a399,1006345701_192000242,Siegener Eisenbahnbedarf Akt.-Ges. in Siegen.,,,820,1908.0,1908-01-20,1908.0,1908-02-13,,,1.0,"Herstellung von Eisenbahnbedarf aller Art, insbes. von Eisenbahnfahrzeugen,",Siegen,Grundst cke Wohn u Gesch Geb ude Fabrikgeb ude innere,Vors Br Ing Heinr Macco M d A Stellv Dir,Ober Ing Jos Meyer Karl Jaskulke Wilh Molfenter Otto Rhese,M 2 300 000 in 2300 Aktien M 1000 Urspr,24,"Maschinen- und Armaturen-Fabriken, Eisengiessereien etc."
7956818de3,1006345701_191400181,Kunst- und Verlags-Anstalt Schaar und Dathe.,Kommanditgesellschaft auf Aktien in Trier.,,1966,1904.0,1904-08-05,1904.0,1904-10-10,,,1.0,Übernahme und Fortführung der früher unter der Firma,Trier,Immobil Mobil Rohmaterial Waren Autoren Patent u Beteilig Kto Kassa,Vors Komm Rat Wilh Rautenstrauch Stellv Arnold Steingroever Rechtsanwalt Dr,,M 1 000 000 in 1000 Aktien M 1000 Urspr,18,Polygraphische Gewerbe
836f685969,1006345701_192000242,"Providentia, Aktiengesellschaft in Trier.",,Firma bis 1906 mit dem Zusatz: Akt.-Ges. für Mädchen-Unterrichts- und,1853,,,,,,,,,Trier,Aktiva Kassa Wertp Immobil Mobil Debit Verlust Passiva A K,,,M 600 000 in 200 Aktien M 3000 Hypotheken M,24,"Vereins- und Gesellen-Häuser, Herbergen."
7f3352c083,1006345701_192000241,Solenhofer Aktien-Verein in München.,Theatinerstrasse 7.,,1692,1857.0,1857-01-23,,,,,1.0,"Betrieb der im Besitze bereits befindlichen, der etwa",München,Grundbesitz Elektrizit tsanlage Masch Werkzeuge u Hilfsstoffe Gespann Einricht Kassa,Vors Dr Rich Freih von Michel Raulino Bamberg Stellv Rechtsanwalt,,M 950 000 in 1488 Aktien M 500 u 206,24,"Marmor-, Basalt- und Schieferbrüche etc."
75c0893225,1006345701_192000241,"„Allianz' Versicherungs-Aktien-Gesellschaft in Berlin,","W., Taubenstrasse 1/2. Mit Zweigniederlassung in München.",,678,1890.0,1890-01-13,1890.0,1890-02-05,,,1.0,"Direkter u. indirekter Betrieb von Unfall- u. Haftpflichtversich.,",Berlin,Forder an die Aktion re Grundbesitz Hypoth Wertp Vorauszahl u,Mind Vors Reichsrat W von Finck M nchen Stellv Geh,R v Balcke J Biesterfeld A Brandes M Gl ser,M 12 500 000 in 12 500 Nam Aktien M,24,Versicherungs-Gesellschaften aller Branchen
fdc951b698,1006345701_192000241,"Kollmar & Jourdan A.-G., Uhrkettenfabrik in Pforzheim Neckarbischofsheim.","mit Zweigniederlassungen in Mühlhausen a. Würm, Boxberg (Baden) und",,1372,1898.0,1898-09-11,1898.0,1898-09-20,,,1.0,Herstell. u. Verkauf von Uhrketten u. Bijouteriewaren. Die,Pforzheim,Immobil I II u III u Grundst abz M Hypothek,Vors Stadtrat Alb Wittum Pforzheim Stellv Stadtrat Dr Friedr Weill,Karl Faas Fritz Buck ,M 4 000 000 in 4000 Aktien M 1000 Urspr,24,Metall-Industrie
