company_id,oai_identifier,company_name,company_info_1,company_info_2,pdf_page_num,found_year,found_date_modified,register_year,register_date_modified,effect_date_modified,effect_year,item_rank,purpose,city,bs_text,sboard_text,proc_text,capital_text,volume,industry
5d84e5e6ea,1006345701_191400181,"F. W. Gantenberg, Akt.-Ges. in Aue (Erzgeb.).",,,2621,1912.0,1912-12-16,1912.0,1912-12-19,,,1.0,Übernahme u. Fortführ. des bisher unter der Firma,Aue,Grundst ck u Geb ude Wasserleit Masch Inventar Pferde u,Vors Komm Rat Fr Wilh Gantenberg Aue Rechtsanw Justizrat Dr,Curt Semmt Johs Mehlhorn Max IIling ,M 1 500 000 in 1500 Aktien M 1000 bernommen,18,Bekleidungs-Industrie.
b6b7af6776,1006345701_190100051,"Elsässisch-Badische Wollfabriken, Aktiengesellschaft",in Strassburg-Ruprechtsau mit Filiale in Kehl.,,1455,1899.0,1899-05-08,,,,,1.0,Betrieb einer Kammgarnspinnerei und Weberei einschliesslich der damit,Strassburg-Ruprechtsau,Immobilien Mobilien u Einrichtung Pferde u Wagen Rohmaterialien u Waren,Paul Wenger Jos Rosenmeyer Ed Herzberg Strassburg i E ,,M 400 000 in 400 Aktien Nr 1 400 M,5,Textil-Industrie.
568ece573a,1006345701_190100052,"Stellv. Bankier F. L. Bauer, Gottfr. Reichelbräu. Aktien-Gesellschaft in Kulmbach.",,,1279,1895.0,1895-01-09,,,,,1.0,Übernahme und Weiterbetrieb,Kulmbach,,,,35 228 24,5,Brauereien.
6c3854eda6,1006345701_190500091,ank für Handel Sächs.-Thüring. Act.-Ges. für Braunkohlen-Verwerthune,in Halle a. 8.,,766,1855.0,1855-12-31,,,,,1.0,,Halle,Gruben Grubenbau Grundst cke Geb ude u Baukto Utensil u,Vors Geh Reg Rat Oberb rgermeister a D von Voss,Wilh Garke Franz Schnellinger Max K hne ,M 4 999 200 in 4500 St Aktien mit Nummern,9,"Bergwerke, Hütten- und Salinenwesen."
5c54acecce,1006345701_190100052,Kapuzinerbräu-Aktiengesellschaft in Kulmbach.,,,1276,1897.0,1897-04-29,,,,,1.0,Fortbetrieb der Brauerei „Chr. Viandt-“' in Mainleus. Bierproduktion,Kulmbach,Immobilien Maschinen K hlanlage Brauerei Utensilien Wirtschafts do Fuhrwerk Lagerf,,,M 275 000 in 275 Aktien M 1000 Urspr A,5,Brauereien.
a3fedfded7,1006345701_189800021,"Strassburger Bank Ch. Staehling, L. Valentin & Cie.",Kommanditgesellschaft auf Aktien in Strassburg i. Els.,,195,1852.0,1852-10-23,,,,,1.0,Betrieb von Bankgeschäften aller Art.,Strassburg,Passiva Debet Kredit Kapitalkonto Gesetzl Reserve Spezial Reserve Vorsichtsfonds Pensionsfonds,Vors C Bergmann Handelsrichter C Boeckel C M ller L,A Gerhard J Sutter Ch Lemm E Helderle ,M 4 800 000 in 6000 Namen Aktien M 800,2,Geldinstitute etc.
648bc1c21f,1006345701_189800022,Aktien-Zuckerfabrik Lehrte in Lehrte.,,,503,1884.0,1884-08-03,,,,,1.0,,Lehrte,Aktiva Fabrikanlage M Kassa M Vorr te M Sa M,,,M 263 400 in Aktien Anleihe M 630 000 in,2,Nahrungs- und Genussmittel-Industrie.
1412ff6909,1006345701_190500092,segeseseeegfcg Münchener Boden-Akt.-Ges. in München.,,,167,1903.0,1903-12-10,1903.0,1903-12-12,,,1.0,"Erwerb, Bewirtschaftung u. Bebauung, Wiederveräusserung u. sonst. Verwertung",München,,,,M 1 200 000 in 1200 Aktien M 1000 begeben,9,Geld-Institute etc.
8f06beb6c5,1006345701_191500192,MUMaschinen- u. Dampfkessel-Armaturen-Fabrik Schäffer & Budenberg Ges. m. b. H. in Magdeburg.,,,806,1850.0,1850-08-03,1901.0,1901-12-31,,,1.0,Herstell. u. Vertrieb von Masch.- u. Dampfkessel-Armaturen. Die,Magdeburg,Immobil Masch Fabrik Einricht Inventar etc fertige u unvollendete Fabrikate,Geh Komm Rat Otto Arnold Magdeburg B Rittergutsbes Fritz Dresel,Otto Dresel Alfred Richter Carl Wahrendorf ,Kapital M 5 880 000 in St Anteilen ,19,"Maschinen- und Armaturen-Fabriken, Eisengiessereien etc."
4c0a950054,1006345701_189800021,Eschweiler Bank in Eschweiler.,,,107,1890.0,1890-08-03,,,,,1.0,,Eschweiler,Kassa M Effekten M Wechsel M Guthaben bei Banken M,Vorsitzender Hugo Merckens P Besgen A Klinkenberg H L tgen,,M 300 000 in 300 Aktien M 1000 Gesch ftsjahr,2,Geldinstitute etc.
6d4805b19c,1006345701_189800022,"Vereinsbrauerei Apolda, Akt.-Ges. in Apolda.",,,601,1887.0,1887-08-03,,,,,1.0,Betrieb einer Bierbrauerei. Bierabsatz ca. 41 000 hl.,Apolda,,Vors Oskar Schmid Stellv Carl Ludwig Emil Bohring Rechtsanwalt August,,M 1 020 000 in 120 Aktien M 1000 nach,2,Brauereien.
b61e0323d3,1006345701_190300071,Deutscher Anker,"Pensions- u. Lebensversicherungs-Aktienges. in Berlin, S. Friedrichstr. 236.",,560,1898.0,1898-01-20,1898.0,1898-08-13,,,1.0,"Versicherung und Rüchversicherung von Kapitalien, Renten und Entschädigungen",Berlin,Wechsel d Aktion re Hypoth Wertp Darlehen auf Policen Guth,,,M 8 000 000 in 4000 Nam Aktien Nr 1,7,Versicherungs-Gesellschaften aller Branchen.
265d3722e1,1006345701_189800021,Berlin-Rüdersdorfer Hab Actien-Gesellschaft,"in Berlin, O. Fruchtstrasse 8.",,868,1890.0,1890-01-06,,,,,1.0,,Berlin,Grund u Boden M Geb ude M Maschinen M Utensilien,,,M 1 500 000 in 1500 Inhaberaktien M 1000 ,2,Bekleidungs-Industrie.
5ba7931b2f,1006345701_190400081,Rheinische Portland-Cementwerke in Köln a. Rh.,,,1011,1899.0,1899-01-21,,,,,1.0,"1900/1901. Zweck: Errichtung, Erwerb und Betrieb von Cement-",Köln,Grundst cke Porz Steinbr che Budenheim Thonfeld Oberpleis Fabrikgeb ude,,,,8,Industrie der Steine und Erden.
c562119e8c,1006345701_191400182,Theaterbau-Gesellschaft Akt.-Ges. in Frankfurt a. M.,Bethmannstr. 50.,,1672,1910.0,1910-05-04,1910.0,1910-07-09,,,1.0,Errichtung u. Verpachtung des „Neuen Theaters“ in Frankf.,Frankfurt,Grundst ck Geb ude Mobil Theaterbetriebs Kto Fundus Zs Versich,Vors Justizrat Dr Moritz Passavant Stellv Bankier Bernh Kahn Baron,,M 450 000 in 450 Namen Aktien M 1000 Urspr,18,Theater und Opern-Häuser.
cd67dda9d3,1006345701_191500192,*paul Hildebrandt & Co. Akt.-Ges. in Hamburg,,,1403,1913.0,1913-09-27,1913.0,1913-09-30,,,1.0,"Verarbeit. von Getreide- u. Hülsenfrüchten, Herstell. von Futtermitteln",Hamburg,,Vors Bank Moritz Schultze Magdeburg Heinr Carl Hedrich Altona Erich,,M 1 000 000 in 1000 Aktien M 1000 ,19,"Getreide-Mühlen, Brot-Fabriken etc."
f2e6789b5c,1006345701_190000042,"Präcisions-Gussstahl-Kugelwerke München-Aibling, A.-G.","in München, Direktion in Bad-Aibling.",,456,1897.0,1897-12-06,,,,,1.0,"Fabrikation und Verschleiss von Gussstahlkugeln, Kugellagern jeder Art,",München,Grundst cke u Geb ude Wasserkraft Maschinen u Werkzeuge Mobilien,Vors Ober Reg Rat a D Jos Englert Rittm a,,M 500 000 in 500 Aktien Nr 1 500 M,4,Metall-Industrie.
8455ddcb91,1006345701_189800021,Oldenburger Versicherungs-Gesellschaft in Oldenburg,im Grossherzogtum.,,345,1857.0,1857-08-03,,,,,1.0,,Oldenburg,Wechsel der Aktion re M Grundbesitz M Hypotheken M Wertpapiere,Vors A Schwartz in Oldenburg Stellv G Alhorn in Jade,,M 3 000 000 in 2000 Aktien M 1 500,2,Versicherungs-Gesellschaften aller Branchen.
aa4d6cba7b,1006345701_189800021,"Berliner Aquarium, Commandit-Gesellschaft auf Aktien.",Fr. Hermes & Compagnie in Berlin. Unter den Linden 68a.,,752,1867.0,1867-08-03,,,,,1.0,Ein- und Verkauf sowie Ausstellung lebender Land- und,Berlin,Grundst cke u Geb ude M Dampfkessel Pumpen etc M,Vors S Weill Firmenzeichnung Beide pers nl haftenden Gesellschafter ,,M 900 000 in 1500 Kommanditanteilen M 600 Hypotheken M,2,"Zoologische Gärten, Aquarien usw."
e3ea198b19,1006345701_189800022,Mallisser Ziegelei- u. Bergwerks-Gesellschaft in Malliss i. M.,,,393,1883.0,1883-08-03,,,,,1.0,,Malliss,Ziegelei Ilmmobile M Thon und Sandlager M Bergwerks Immobile M,B Sch nfeld Dr F Sthamer Hamburg Dr S Lehmann,,M 850 000 in 1700 Aktien M 500 Hypotheken M,2,Industrie der Steine und Erden.
9d6740f32c,1006345701_191300171,Eiswerke Huxmann Akt.-Ges. in Bremen.,,,1991,1911.0,1911-02-11,1911.0,1911-03-21,1911-01-01,1911.0,1.0,Herstellung u. Verkauf von Eis jeglicher Art sowie,Bremen,Grundst cke Geb ude Masch Pferde u Wagen Inventar Ger,Vors Bankier Dr jur Aug Wilh Strube Konsul Otto Flohr,Joh Bohne Ludw Huxmann ,M 550 000 in 550 Aktien M 1000 Hypotheken M,17,"Wasser- und Eiswerke, Kühlhallen etc."
41cb15ba4b,1006345701_191000141,"Deutsche Kolonialbank Akt.-Ges. in Liquid. in Berlin,",W. Augustastrasse 14.,,367,1908.0,1908-12-07,1908.0,1908-12-23,,,1.0,,Berlin,,Vors Gen Dir Bankier Wilh Mertens Dir Heinr Gremmler Berlin,,M 5000 in 5 Aktien M 1000 begeben zu pari,14,Hypotheken- und Kommunal-Banken.
eaa6910702,1006345701_191300172,*Act.-Ges. Tonwerke Wübbenhorst in Delmenhorst.,,,1064,1911.0,1911-11-16,1911.0,1911-12-04,,,1.0,Erwerb u. Betrieb von Ziegeleien u. Tonwarenfabriken u.,Delmenhorst,,Vors Molkerei Dir Heinr Mennen Stellv Auktionator Joh Meyer Kaufm,,M 140 000 in 140 Aktien M 1000 ,17,Industrie der Steine und Erden.
10d84ecb43,1006345701_189800021,Gesellschaft des Emser Blei- und Silberwerkes in Ems.,,,483,,,,,,,,"Gewinnung von Blei und Silber, Zink-; Kupfer- und",Ems,Kassa M Debitoren M Inventar M Effekten M Verlustvortrag aus,,,M 2 400 000 in Aktien ,2,"Bergwerke, Hütten- und Salinenwesen."
8de29a0170,1006345701_190400082,Aktiengesellschaft Kraft und Licht in München.,,,1093,1902.0,1902-08-11,1902.0,1902-11-18,1902-11-18,1902.0,1.0,"Erwerbung von Elektricitätswerken oder deren Werten, Beteilig. an",München,Beteilig Darlehen Effekten Kassa Debit Passiva A K Kredit R,Vors Hch Reinhard M nchen Stellv Komm Rat Friedr Tr,,M 160 000 in 160 Aktien M 1000 ,8,"Elektrotechnische Fabriken, Elektrizitätswerke und Hilfsgeschäfte."
711b68a7d3,1006345701_190500091,"Bayer. Wollfilz-Fabrik (Act.-Ges.), Sitz in Augsburg","Fabrik in Wasserburg-Günzburg a. D. Niederlage in Berlin, Pandahsef 8",,1486,1889.0,1889-06-07,1889.0,1889-07-03,,,1.0,Betrieb der 1889/1890 neu erbauten Wollfilzfabrik. 1898 wurde,Augsburg,Immobil Einricht Wollen u Material Kassa Wechsel Effekten u Bankguth,Vors Komm Rat Max Schwarz Stellv Rentier Gust Riedinger kgl,,M 1 250 000 in 1250 Aktien M 1000 Urspr,9,Textil-Industrie.
4956a1c5a8,1006345701_191100152,„Frankonia'' in Tauberbischofsheim.,,,1269,1894.0,1894-12-04,,,,,1.0,"Druck u. Verlag des „Tauber- u. Frankenboten“', des",Tauberbischofsheim,,Vors Stadtpfarrer Wilh Epp Prokurist u Gesch ftsleiter Redakteur K,,M 90 000 in 450 Aktien M 200 Urspr M,15,Polygraphische Gewerbe.
36d9d686f3,1006345701_190300071,Actiengesellschaft vorm. Seidel & Naumann in Dresden.,,,1134,1886.0,1886-05-06,,,,,1.0,"Herstellung und Verkauf von Nähmaschinen und Fahrrädern, deren",Dresden,Grundbesitz Geb ude Maschinen Fabrikeinricht Giessereieinricht Utensil Tischlereiwerkzeuge Pferde u,Vors Berth Wuttig Konsul O Harlan Georg Hoffmann Otto Fischer,,M 3 000 000 in 3000 Aktien Nr 1 3000,7,"Maschinen- und Armaturen-Fabriken, Eisengiessereien etc."
b765b022d9,1006345701_189800021,"Wasserwerk St. Wendel in Landau, Pfalz.",,,722,1888.0,1888-06-11,,,,,1.0,,Landau,Kassa M Effekten M Grundst ck M Wasserwerksanlage M Wassermesser,Ing Th Jooss in M nchen Fr Th Jooss und,,M 150 000 in 150 Aktien M 1000 ,2,Wasserwerke.
2e6aafb157,1006345701_189800021,Baumwollspinnerei Unterhausen in Unterhausen,bei Reutlingen.,,841,1883.0,1883-08-03,,,,,1.0,,Unterhausen,Immobilien Maschinen M Kassa u Wechsel M Vorr te M,Vors Geh Hofrat Carl Staib Stellv Geh Hofrat Albert v,,M 1 700 000 in 1 700 Aktien M 1000,2,Textil-Industrie.
2175176fed,1006345701_189800021,Actien-Gesellschaft Schloss-Hotel und Hotel Bellevue,in Heidelberg.,,779,1886.0,1886-08-03,,,,,1.0,,Heidelberg,Schlosshotelkonto M Immobilien M Mobilien M Grundbesitz M Fuhrpark M,,,M 1 200 000 in 1200 Inhaberaktien M 1000 Hypotheken,2,Hotels und Gasthäuser.
8f30ee475b,1006345701_190800122,"Hirsch, Janke & Co. Aktien-Ges. in Weisswasser O.-L.","Zweigniederlassung in Berlin, Rungestr. 18a.",,923,1906.0,1906-09-14,1906.0,1906-09-22,1906-04-01,1906.0,1.0,Fabrikation u. Vertrieb von Glaswaren aller Art sowie,Weisswasser,Aktiva Grundst cke Geb ude Gleisanlagen Ofenanlagen Masch Utensil u,Vors Adolf Hirsch Weisswasser Stellv Carl Janke Bankdir Herm Zeitz,,M 1 000 000 in 1000 Aktien M 1000 Hypotheken,12,Industrie der Steine und Erden.
dedd382596,1006345701_189800021,Dampfschifffahrts-Gesellschaft auf dem Würmsee,in München.,,448,1864.0,1864-11-15,,,,,1.0,Beförderung von Passa.,München,Anwesen u Schiffe ,,,M 154 000 in 440 Ak,2,Verkehrs- und Transport-Gesellschaften.
79b4f76036,1006345701_190900132,Gemeinnützige Baugesellschaft Heidenheim a. Br. A.-G.,in Heidenheim a. Br.,,188,1907.0,1907-05-23,1907.0,1907-08-10,,,1.0,"Gegenstand des Unternehmens ist, für weniger bemittelte Einwohner",Heidenheim,Aktiva Grundst ck Monzartstr do Steinstr Geb ude Mozartstr do,Vors Oberb rgermeister Eugen Jaekle Stellv Komm Hat Alb Hartmann,,M 125 000 in 125 Aktien M 1000 ,13,Geld-Institute etc.
61e1a8ed90,1006345701_189900031,Lübeck-Büchener Eisenbahn-Gesellschaft in Lübeck.,,,1161,1850.0,1850-08-03,,,,,1.0,"Bau und Betrieb der Bahnlinie Lübeck-Büchen, eröffnet am",Lübeck,F r Bahnanlagekosten u s w M Effekten M Bankguthaben,Vors Senator Hermann Eschenburg Stellv Sen Georg Arn Behn Wilh,,M 20 790 000 in 30 790 Aktien M 600,3,Nachträge [aller Branchen]
f053baa191,1006345701_189900031,Koenigin-Marienhütte Actien-Gesellschaft,in Cainsdorf b. Zwickau i. S.,,504,1872.0,1872-01-30,,,,,1.0,,Cainsdorf,,,,M 6 000 000 in 10 000 Aktien M 600,3,"Bergwerke, Hütten- und Salinenwesen."
edc7422065,1006345701_189800021,Stuttgarter Immobilien- und Bau-Geschäft in Stuttgart,mit Filiale in Blaubeuren.,,291,1871.0,1871-08-03,,,,,1.0,"Fabrikation von Baumaterialien, An- u. Verkauf von Immobilien,",Stuttgart,Kassa M Wechsel M Effekten M Realit ten M Debitoren,,Franz Burger Carl Volz Firmenzeichnung Zwei Vorstandsmitglieder ,M 2 200 000 in 4000 Stammaktien M 300 u,2,Geldinstitute etc.
c4921c2ef0,1006345701_191300172,Leitzachwerke Aktiengesellschaft in München.,,,1007,1911.0,1911-09-23,1911.0,1911-11-16,,,1.0,"Gewerbsmäss. Erzeug. elektr. Stroms jeder Art, besonders zur",München,Grundst cke u Geb ude DienstbarkeitenKto Anzahl u Ausgaben auf,Vors Justizrat Phil Grimm Stellv Bankier Ernst Friedmann Berlin rechtsk,,M 6 000 000 in 6000 Aktien M 1000 bernommen,17,"Elektrotechnische Fabriken, Elektrizitätswerke und Hilfsgeschäfte."
f52a46ec71,1006345701_190400082,"Carlshütte, Act.-Ges. für Eisengiesserel und Maschinenbau",,in Altwasser i. Schl.,396,1890.0,1890-04-10,,,,,1.0,Betrieb einer Eisengiesserei u. Maschinenbau-Anstalt. Spec.: Masch. u.,Altwasser,Grundst ck Geb ude Roh u andere Material fertige Produkte,,,M 1 250 000 in 1250 Aktien M 1000 Urspr,8,"Maschinen- und Armaturen-Fabriken, Eisengiessereien etc."
eddab48485,1006345701_190600101,A-G. für Buntpapier u. Leim-Fabrikation in Aschaffenburg.,,,1291,1859.0,1859-05-01,,,,,1.0,"Fortbetrieb der Buntpapier- und Leimfabrik, vormals Franz Dessauer.",Aschaffenburg,,Vors Komm Rat Hch Albert Wiesbaden Stellv Reg Baumeister Sch,Emil Knothe Michael H rner Kurt Weise Phil Bourdon ,M 1500 000 in 3385 Aktien Nr 1 3385 M,10,"Papier-, Pappen- und Cellulose-Fabriken."
a4d024858c,1006345701_190500091,"Krefelder Stahlwerk, Act.-Ges. in Crefeld.",,,843,1900.0,1900-04-05,1900.0,1900-05-29,,,1.0,Errichtung u. Betrieb von Werken zur Herstellung von,Crefeld,Immobil Vorr te u Debit Verlust Passiva A K Oblig,Vors Gen Dir Franz Burgers Bulmke b Gelsenkirchen Au Tnyssen,,M 1 000 000 in 1000 Aktien M 1000 Urspr,9,Metall-Industrie.
64e3c3cf8c,1006345701_189800021,Düngerfabrik Kaiserslautern in Kaiserslautern.,,,948,1863.0,1863-08-03,,,,,1.0,,Kaiserslautern,Anlage M Debitoren M Kassa Wechsel M Kaution M Effekten,,,M 360 000 in Aktien Gesch ftsjahr 1 November bis,2,Chemische Industrie und damit verwandte Zweige.
7612605584,1006345701_190400082,"Kleinbahn-Act.-Ges. Putzig-Krockow in Putzig, W.-Pr.",,,1031,1902.0,1902-07-05,1902.0,,,,1.0,Bau und Betrieb einer normalspur. Kleinbahn von Putzig,Putzig,R ckst Aktieneinzahl Baukosten Debit Passiva A K Disp F,,,M 1 018 000 in 1018 Aktien M 1000 ,8,"Strassen- und Kleinbahnen, Bergbahnen etc."
8bd23580b1,1006345701_189800022,Zuckerfabrik Frankenthal in Frankenthal i. Rheinpfalz.,,,488,1873.0,1873-10-06,,,,,1.0,Fabrikation von Zucker aus Rüben. Kapital: M. 4,Frankenthal,Liegenschaften M Maschinen Ger te und Geb ude M Mobilien,Ferd Scipio Firmenzeichnung Vorstand oder Prokuristen kollektiv ,,,2,Nahrungs- und Genussmittel-Industrie.
63c5b4e005,1006345701_189800022,Actiengesellschaft Liederkranz in Mannheim.,,,583,,,,,,,,,Mannheim,Haus M Mobilien M Billard M Kassa M Einrichtung M,,,M 4500 Hypotheken M 55 000 Obligationen M 51 800,2,"Private und öffentliche Gesellschaftshäuser, Konzert-, Vergnügungs- und Erholungsetablissements."
5e0f47346d,1006345701_189800022,Maschinenbaugesellschaft Karlsruhe in Karlsruhe i. Bad.,,,315,1852.0,1852-07-22,,,,,1.0,"Bau und Vertrieb von Lokomotiven, Maschinen aller Art;",Karlsruhe,Liegenschaften und Einrichtungen M Materialvorr te M fertige u in,Vors Komm Rat Robert Koelle in Karlsruhe W Freih v,,M 1 750 000 in 2500 Aktien M 700 ,2,"Maschinen- und Armaturen-Fabriken, Eisengiessereien, Stahlwerke usw."
62a5ce0608,1006345701_191300171,Hamburger Hochbahn-Akt-Ges. in Hamburg.,,,2422,1911.0,1911-05-27,1911.0,1911-10-09,,,1.0,Übernahme u. Ausführung des von der Siemens &,Hamburg,,Vors Gen Dir Dr Ing Albert Ballin Stellv Arthur Warncke,,M 15 000 000 in 15 000 Aktien M 1000,17,"Elektrische Straßenbahnen, Klein- und Pferdebahnen etc."
4e4cb78201,1006345701_189800022,Papier- und Tapetenfabrik Bammenthal,"vormals Scherer & Dierstein, A.-G. in Bammenthal i. Baden.",,421,1895.0,1895-11-16,,,,,1.0,,Bammenthal,Immobilien M Maschinen u Werkzeuge M Utensilien M Walzen u,Bankdirektor Paul Klaproth in Mannheim Direktor Dolletscheck in Karlsruhe Dr,,M 750 000 in 750 Inhaberaktien M 1000 ,2,Papier-Industrie.
85e6673533,1006345701_189800021,Sylter Dampfschifffahrt-Gesellschaft in Westerland-Sylt.,,,458,1883.0,1883-08-03,,,,,1.0,,Westerland-Sylt,Dampfer Dampfbarkasse Binnendeichsb te Eisb te u Inventarien M Geb,Eschels Aufsichtsrat J Boysen G F W nschmann Rentmeister a,,M 75 000 in 150 Aktien M 500 u M,2,Verkehrs- und Transport-Gesellschaften.
e1d1b230c3,1006345701_190000041,Allgemeine Gas- und Elektricitäts-Gesellschaft in Bremen.,,,1287,1898.0,1898-08-03,,,,,1.0,"Erwerb, Erbauung u. Betrieb von Gasanstalten, Elektricitäts- u.",Bremen,Bestand an Aktien von Gas u Gas u Elektricit tswerken,Vors Joh Schlingmann Stellv Friedr Hollmann Carl Francke sen Gottfr,,M 3 000 000 in 3000 Aktien M 1000 Urspr,4,Gas-Gesellschaften.
0d3629e1f7,1006345701_191200161,Internationale Stickstoff-Aktiengesellschaft in Wiesbaden.,,,1688,1907.0,1907-06-17,1907.0,1907-07-24,,,1.0,"Herstellung chem. Produkte, Handel mit denselben u. Beteiligung",Wiesbaden,,Vors Marc Mangini Lyon Stellv Landrichter a D K ster,,Urspr M 1 000 000 in 1000 St Aktien M,16,Chemische Industrie und verwandte Geschäftszweige.
b68e71022b,1006345701_189800022,Nürnberger Actien-Bierbrauerei vorm. Heinr. Henninger,in Nürnberg.,,718,1872.0,1872-08-19,,,,,1.0,"Betrieb von Bierbrauerei, Mälzerei u. Wirtschaften. Bierabsatz 1895/96–1896/97:",Nürnberg,Immobilien M Inventar M Eisenbahnwagen M Maschinen M F sser,Vors Justizrat Eberhard von Praun Stellv Otto Griesbach Oberstleut a,,M 1 950 000 in 3250 Aktien M 600 nach,2,Brauereien.
f4272dbc54,1006345701_189800022,Römbhildt-Pianofortefabrik Aktien-Gesellschaft,in Weimar.,,344,,,,,,,,Fabrikation von Pianinos.,Weimar,Immobilien M Gesch ftsmobilien M Kassa M Wechsel M Modell,,P Neuschild ,M 300 000 in Aktien Anleihe M 44 000 in,2,Musikwerke- und Musik-Instrumenten-Fabriken.
032dc1386b,1006345701_190400081,Act.-Ges. für Grundbesitz u. Hypothekenverkehr in Berlin,,"NW., Mittelstrasse 2/4. (In Liquidation klt. G.-V. v. 30./12. 1901.)",1734,1883.0,1883-06-16,,,,,1.0,,Berlin,Immobil I do II eig Hypoth Wertp Effektendepotkto Pflasterkaution sonst,Dir Werner Eichmann Kammergerichtsrat a D Wilh Thinius Direktor der,,M 200 000 in 200 Akt M 1000 Urspr M,8,Nachträge.
29c846fb89,1006345701_191100151,"Terrain-Akt.-Ges. Wohldorf-Ohlstedt in Hamburg,",Holzdamm 8.,,597,1909.0,1909-01-15,1909.0,1909-03-15,,,1.0,"Gegenstand des Unternehmens sind der Erwerb, die Verwertung,",Hamburg,,Vors Ing Joh Herm Vering Stellv Carl Otto Krauel Hausmakler,,M 2 300 000 in 2300 Aktien M 1000 begeben,15,"Bau-Banken, Bau-, Terrain- und Immobilien-Gesellschaften etc."
83b90310fc,1006345701_190300072,Saalbau-Gesellschaft in Cassel. (In Liquidation.),,,1071,1881.0,1881-08-03,,,,,1.0,,Cassel,Kassa Debit Verlust Passiva A K Oblig A u B,Vors Justizrat Dr Schier C Has Kreisbaumstr a D Nehus,,M 134 850 in Aktien Anleihe M 91 200 in,7,"Private und öffentliche Gesellschafts-Häuser, Konzert-, Vergnügungs- und Erholungs-Etablissements."
ecbf4454b5,1006345701_189800021,Baubank für die Residenzstadt Dresden in Dresden.,,,270,1885.0,1885-04-01,,,,,1.0,Anlegung einer 20 Meter breiten Strasse zur unmittelbaren,Dresden,,,,M 3 000 000 in 3000 Aktien M 1000 Die,2,Geldinstitute etc.
579ec70fc9,1006345701_190700111,Northeimer Verkehrs-Akt.-Ges. in Northeim.,,,730,1905.0,1905-01-29,1905.0,1905-02-24,,,1.0,Einrichtung und Betrieb von Fahrten mittels Motorwagen zum,Northeim,Kassa u Bankguth Debit Motorwagen Ersatzteile Inventar Umbau Betrieb Verlust,Vors Herm Bartels Carl Fricke Ernst Ahrens M hlen Dir,,M 30 000 in 150 Nam Aktien M 200 Gesch,11,"Lagerhaus-, Speditions- und Omnibus-Gesellschaften etc."
4f1197cdb8,1006345701_190100051,"Berlin-Tempelhofer Terrain-Gesellschaft in Berlin,",SW. Grossbeerenstrasse 88/89.,,467,1899.0,1899-08-03,,,,,1.0,"Erwerb, Verwaltung, ev. teilweise Bebauung und demnächstige Wiederveräusserung",Berlin,Grundst cke Strassenbau Bankguthaben Mobilien Kassa Passiva A K Hypoth,Vors Eisenbahnbau und Betriebsunternehmer Herrm Bachstein Otto Bohlmann Max Magdeburg,,M 2 000 000 in 1000 Nam Aktien Nr 1,5,"Bau-Banken, Bau-, Terrain- und Immobilien-Gesellschaften etc."
9f27b665b2,1006345701_191200161,"Continentale Papiersack-Fabrik Akt.-Ges. in Berlin,","SW. 68, Charlottenstrasse 6, Fabrik in Krappitz.",,1804,1910.0,1910-09-16,1910.0,1910-09-17,,,1.0,Herstell. u. Verkauf von Papiersäcken im Inland u.,Berlin,,,,M 500 000 in 500 Aktien M 1000 bernommen von,16,"Papier-, Pappen- und Cellulose-Fabriken."
0af38fd572,1006345701_190600101,Tattersall am Kurfürstendamm A.-G. zu Charlottenburg.,Kurfürstendamm 208.,,1504,1904.0,1904-03-15,1904.0,1904-03-26,,,1.0,"Errichtung u. Betrieb von Reitbahnen, sowie die Aufnahme",Charlottenburg,,Vors Baumeister Ernst Schmid Wilmersdorf Rittergutsbes George Dotti Rechtsanw Dr,,M 415 000 in 415 Aktien M 1000 Ende 1904,10,Sport-Gesellschaften.
326d956870,1006345701_191400181,Brandenburgische Land Akt.-Ges. in Berlin.,,,565,1912.0,1912-03-25,1912.0,1912-03-27,,,1.0,Erwerb u. Verwertung von Grundstücken jeder Art.,Berlin,,Vors Joh Gottschalk B Hermsdorf Architekt Hermann Wolff Paul Amberg,,M 5000 in 5 Aktien M 1000 bernommen von den,18,"Bau-Banken, Bau-, Terrain- und Immobilien-Gesellschaften etc."
61623567de,1006345701_191300172,Heegermühler Klinker-Werke Akt-Ges. in Eberswalde.,,,1065,1910.0,1910-08-23,1910.0,1910-11-30,,,1.0,"Erwerb, Bau und Betrieb von Ziegel- u. Klinkerwerken",Eberswalde,Kassa Debit Kaut Grundst cke u Geb ude Masch u,,,M 500 000 in 500 Aktien M 1000 Urspr M,17,Industrie der Steine und Erden.
8034732e7d,1006345701_190000041,Norddeutsche Munitionsfabrik Schönebeck a. E.,Aktiengesellschaft in Gross-Salze.,,809,1898.0,1898-10-27,,,,,1.0,"Gewerbsmässige Herstellung und Vertrieb von Kriegsmunition und Waffen,",Schönebeck,wird am Dez gezogen ,Vors Dr Paul Pondorf G ssnitz Stellv Albert Totte Ed,,M 1 000 000 in 1000 Aktien M 1000 ,4,Metall-Industrie.
f6709859e5,1006345701_190700111,"Roland-Linie, Akt.-Ges., Bremen, Obernstr. 44/541.",,,657,1905.0,1905-11-25,1905.0,1905-12-20,,,1.0,Betrieb der Schiffahrt und aller nach dem Ermessen,Bremen,,Vors Senator J M Gildemeister Stellv Franz Ernst Sch tte,,M 7 000 000 in 7000 Aktien M 1000 von,11,"Dampfschiffahrts-Gesellschaften, Rhedereien etc."
d126e90546,1006345701_189900032,Sportpark-Kurfürstendamm-Aktiengesellschaft in Berlin.,,,900,1886.0,1886-08-03,,,,,1.0,Betrieb von öffentlichen Reitbahnen etc. Kapital: M. 20,Berlin,Aktiva Inventar M Grund u Geb udekonto M Kassa M,Rechtsanwalt Martin Henschel Rechtsanwalt Johs G terbock General a D,,M 250 000 in 250 Inhaber Aktien M 1000 ,3,Sport-Gesellschaften.
59ef50bf1b,1006345701_190400082,Internat. Panorama- & Automaten-Akt.-Ges. zu Düsseldorf.,,,876,1899.0,1899-07-17,1899.0,1899-08-29,,,1.0,,Düsseldorf,Grundst ck Geb ude Mobil Automaten Rundgem lde Effekten Kassa,Vors Justizrat Dr jur H Reinartz Stellv Friedr H llstrung,,M 350 000 in 350 Aktien M 1000 Urspr M,8,"Private und öffentliche Gesellschafts-Häuser, Konzert-, Vergnügungs- und Erholungs-Etablissements."
4b11f94e81,1006345701_191800222,„Baumwollspinnerei und Weberei Lampertsmühle,bei Kaiserslautern vorm. G. F. Grohé-Henrich“ in Lampertsmühle.,,1062,1887.0,1887-01-10,,,,,1.0,Betrieb einer mechanischen Baumwollspinnerei u. Weberei. Fabrikate: Garne,Kaiserslautern,Fabrik Grundst cke u Geb ude Masch ,Vors Alexander B rklin Neustadt a d H Stellv Dr,,M 1 600 000 in 1600 Aktien M 1000 A,22,Textil-Industrie.
3c91b22ec1,1006345701_189800022,"Poppelsdorfer Consum-Verein, Act.-Ges. in Poppelsdorf",bei Bonn.,,562,,,,,,,,,Poppelsdorf,Utensilien M Kassa M Gespanne M Baukonto M Debitoren M,,,M 50 000 in 250 Aktien M 200 ,2,"Konsumvereine, Markthallen."
d49351692c,1006345701_190400081,Bergbau- und Schiffahrts-Act.-Ges. Kannengiesser,"in Mülheim a. d. R., Zweigniederlass. in Ruhrort, Gustayvsburg u.",,768,1895.0,1895-11-16,,,1895-01-01,1895.0,1.0,"Erwerb u. Betrieb von Bergwerken, Rhedereibetrieb u. Handel",Mülheim,Zeche Ver Sellerbeck do Roland Schiffe Magazine Geb ude etc,Vors Komm Rat R M ser Dortmund Major a D,,M 7 000 000 in 7000 Aktien Nr 1 7000,8,"Bergwerke, Hütten- und Salinenwesen."
55c3e014ee,1006345701_190800121,Terrain-Akt.-Ges. München-Nymphenburg in München.,,,571,1906.0,1906-01-24,1906.0,1906-01-24,1906-01-01,1906.0,1.0,,München,,,,,12,"Bau-Banken, Bau-, Terrain- und Immobilien-Gesellschaften etc."
0118303343,1006345701_189800021,Cuxhavener Gas-Actien-Gesellschaft in Cuxhaven.,,,711,1884.0,1884-08-03,,,,,1.0,,Cuxhaven,Anlagekonto M Grundst ck M Woanhaus M Kaution M Installation,,,M 270 000 in 400 Aktien M 500 u 70,2,Gasanstalten und Gasglühlicht-Fabriken.
